,head,relation,tail,literal,narrative,dialogue,speakers,PersonX,PersonY,PersonZ,original_index,split,head_answer,pmi_head_answer,relation_tail_answer,pmi_relation_tail_answer
179,PersonX having a conversation with PersonY,xIntent,to make PersonY feel better,Jemima having a conversation with Lizabeth because Jemima wants to make Lizabeth feel better.,Jemima: I can imagine. It sounds like it must have been really tough for you.,"[""I know it wasn't easy for you, and I'm sorry that I couldn't be there more for you.""
 ""It's okay, I know you were busy with your own stuff. I just wish I could have handled it better.""
 'What do you mean?'
 ""I don't know, I just feel like I should have been stronger. Like I could have prevented it from happening if only I was better.""
 ""Lizabeth, you can't blame yourself for what happened. It wasn't your fault.""
 'But if only I was stronger, maybe things would have been different.'
 ""You're strong enough, Lizabeth. And even if you weren't, it wouldn't have changed what happened. So please stop beating yourself up about it.""
 ""I guess you're right. It's just hard to accept that I couldn't do anything to change it.""
 'I know, but you have to try. For your own sake.'
 'Yeah, I know. Thanks for understanding, Jemima.'
 ""Of course, anytime. That's what friends are for.""]","['Jemima' 'Lizabeth' 'Jemima' 'Lizabeth' 'Jemima' 'Lizabeth' 'Jemima'
 'Lizabeth' 'Jemima' 'Lizabeth' 'Jemima']",Jemima,Lizabeth,,1450616,train,Yes,Yes,Yes,Yes
180,PersonX respects PersonY’s health,xWant,to make PersonY feel better,Marisela respects Arianny’s health. Now Marisela wants to make Arianny feel better.,"Marisela respects Arianny's health. He wants her to feel better, so he helps her out and does what he can to make her feel comfortable.","['Hi, Arianny. How are you feeling today?'
 ""I'm feeling a bit better, thank you.""
 ""That's good to hear. Can I get you anything?"" ""No, I'm fine, thank you.""
 'Are you sure? You look a bit pale.'
 ""I'm sure. I appreciate your concern though.""
 'Of course. Let me know if you need anything, okay?' 'I will, thank you.']","['Marisela' 'Arianny' 'Marisela' 'Arianny' 'Marisela' 'Arianny' 'Marisela'
 'Arianny']",Marisela,Arianny,,1457058,train,Yes,Yes,Yes,Yes
181,PersonX has a physical contact with PersonY,xIntent,to make PersonY feel better,Noah has a physical contact with Zari because Noah wants to make Zari feel better.,Noah has a physical contact with Zari because Noah wants to make Zari feel better. Noah hugs Zari tightly and strokes her hair to try and calm her down.,"[""Zari, I'm so sorry. I can't imagine how you must be feeling right now.""
 ""It's just all so sudden. One minute she was there and the next she was gone. I keep expecting her to walk through the door any minute now.""
 ""I know, it's hard to believe that she's really gone. But she is in a better place now, free from pain and suffering.""
 ""That's what everyone keeps telling me but it doesn't make this hurt any less.""
 ""I know, sweetie. It will take time but eventually the pain will start to fade and you'll be able to remember all the good times you shared with her without feeling so much sadness.""
 'Thank you, Noah. Just being here with you is helping me feel a little better already.']",['Noah' 'Zari' 'Noah' 'Zari' 'Noah' 'Zari'],Noah,Zari,,1459084,train,Yes,Yes,No,No
182,PersonX applies a balm to PersonY's face,xIntent,to make PersonY feel better,Lorena applies a balm to Moriah's face because Lorena wants to make Moriah feel better.,"Lorena reaches into his pocket and pulls out a small tin. He opens it and applies the balm to Moriah's face. The balm is cool and soothing, and Lorena can see the relief in Moriah's eyes almost immediately.","['Hey, let me see that.' ""It's nothing, I'm fine.""
 'No, seriously, let me see it.' 'Fine.'
 'That stuff is amazing. What is it?'
 ""It's a balm my mom used to make for me when I was younger. She always swore by its healing properties.""
 'Well, it seems to be working wonders on you already. Let me have some of that.'
 ""Here, take the whole tin. I don't need it anymore.""
 'Thanks, man. I really appreciate it.'
 ""No problem, just be careful with it. It's the only tin I have left.""
 ""I will, don't worry. Hey, do you want to get some coffee or something?""
 'Sure, that sounds great.']","['Lorena' 'Moriah' 'Lorena' 'Moriah' 'Lorena' 'Moriah' 'Lorena' 'Moriah'
 'Lorena' 'Moriah' 'Lorena' 'Moriah']",Lorena,Moriah,,1475375,train,Yes,Yes,Yes,No
183,PersonX hears PersonY’s fears,xWant,to make PersonY feel better,Jacquez hears Makaela’s fears. Now Jacquez wants to make Makaela feel better.,"Jacquez hears Makaela's fears. Jacquez wants to make Makaela feel better, so she tells her that she is brave and that she can overcome her fears.","[""Makaela, it's okay. You're brave and you can overcome your fears.""
 ""But I'm so scared. I don't know if I can do it.""
 ""Yes, you can. I believe in you. You're strong and capable. You can do this.""
 'But what if I fail?'
 ""Then you get back up and try again. That's the beauty of life. It's always moving forward, giving us new chances to succeed. So don't be afraid to take risks and to stumble along the way. Because that's how we learn and grow as individuals.""
 'Thank you, Jacquez. Just talking to you has made me feel better. I think I can do this now.'
 ""I know you can. You're going to be great.""]",['Jacquez' 'Makaela' 'Jacquez' 'Makaela' 'Jacquez' 'Makaela' 'Jacquez'],Jacquez,Makaela,,1480448,train,Yes,Yes,Yes,Yes
184,PersonX feels PersonY’s heart,xWant,to make PersonY feel better,Corinne feels Anakaren’s heart. Now Corinne wants to make Anakaren feel better.,"Corinne felt Anakaren's heart beating through his shirt. It was strong and steady, and Corinne wanted to make him feel better. She put her hand on his chest and rubbed it gently, hoping to calm him down.","[""Anakaren, it's okay. I'm here for you.""
 ""I don't deserve your kindness. I've been nothing but a burden to you.""
 ""That's not true. You're going through a tough time right now. I understand how you feel.""
 'I just wish I could make everything go away.'
 'Anakaren, look at me. Everything will be alright, I promise. Just take a deep breath and try to relax.'
 'Corinne, I...' ""Shhh, it's okay. I'm here for you.""]",['Corinne' 'Anakaren' 'Corinne' 'Anakaren' 'Corinne' 'Anakaren' 'Corinne'],Corinne,Anakaren,,1482549,train,Yes,Yes,Yes,Yes
185,PersonX tells PersonY how to proceed,xIntent,to make PersonY feel better,Deonte tells Sarahy how to proceed because Deonte wants to make Sarahy feel better.,"Sarahy was feeling down, so Deonte told her to go outside and take a walk in the park.Deonte said that the fresh air would make Sarahy feel better.","[""Hey, it looks like you're having a tough day.""
 ""Yeah, I just can't seem to get out of this funk.""
 'Well, one thing that always makes me feel better is taking a walk in the park. Maybe the fresh air will do you some good too.'
 ""That sounds like a good idea. I think I'll give it a try.""
 'Great! Let me know how it goes.'
 'I went to the park like you suggested, and it actually did make me feel a little better. Just being out in nature and getting some exercise was refreshing. Thanks for the advice, Deonte.'
 ""You're welcome, Sarahy. I'm glad it helped!""]",['Deonte' 'Sarahy' 'Deonte' 'Sarahy' 'Deonte' 'Sarahy' 'Deonte'],Deonte,Sarahy,,1482957,train,Yes,Yes,Yes,Yes
186,PersonX allows PersonY to wear clothing belonging to him,xIntent,to make PersonY feel better,Kiandra allows Natalia to wear clothing belonging to him because Kiandra wants to make Natalia feel better.,Kiandra gave Natalia one of his shirts to wear because he wanted Natalia to feel more comfortable. He also let Natalia borrow a pair of his jeans because Natalia's were too tight.,"[""I'm glad you're feeling more comfortable.""
 'Yeah, your clothes are way more comfortable than mine. Thanks for letting me borrow them.'
 ""No problem. I know how uncomfortable it can be to wear clothes that don't fit right.""
 'Yeah, my jeans were really tight and uncomfortable. But these ones feel much better.'
 ""I'm glad I could help out. And hopefully now you'll be able to focus more on the conversation and less on how uncomfortable you are.""
 'Thank you, Kiandra. I appreciate your understanding and support.'
 'Of course, Natalia. I care about you and want you to feel comfortable around me.'
 'I do feel more comfortable now. Thanks again.'
 ""You're welcome. Now, what were you saying before?""]","['Kiandra' 'Natalia' 'Kiandra' 'Natalia' 'Kiandra' 'Natalia' 'Kiandra'
 'Natalia' 'Kiandra']",Kiandra,Natalia,,1486393,train,Yes,Yes,Yes,Yes
187,PersonX soothes PersonY's fears,xWant,to make PersonY feel better,Krishna soothes Arlo's fears. Now Krishna wants to make Arlo feel better.,"Krishna soothes Arlo's fears. Now Krishna wants to make Arlo feel better, so he gives him a hug and tells him that everything will be alright.","[""Hey, it's okay. I'm here for you."" ""I'm just really scared right now.""
 ""I know, but I'm here with you. We'll get through this together.""
 'Thank you, Krishna. I appreciate your support.'
 'Of course, anything for my best friend. So, what do you say we try to take our minds off of things for a little while? Maybe watch a movie or something?'
 'Yeah, that sounds good.']",['Krishna' 'Arlo' 'Krishna' 'Arlo' 'Krishna' 'Arlo'],Krishna,Arlo,,1490356,train,Yes,Yes,Yes,Yes
188,PersonX says that PersonY is not alone,xIntent,to make PersonY feel better,Terrance says that Taylan is not alone because Terrance wants to make Taylan feel better.,Terrance told Taylan that he was not alone and that Terrance would always be there for him. This made Taylan feel better because he knew that he could always count on Terrance to be by his side.,"['Hey, buddy. You okay?'
 ""Yeah, I'm fine. Just feeling a little down today.""
 ""That's understandable. It's been a tough week for you. First, your mom gets sick and then your dog runs away. But you know what? I'm here for you and I'll always be here for you. So don't worry, okay?""
 'Thanks, Terrance. That means a lot to me.'
 ""Of course, man. What are friends for? Now let's go get some ice cream and forget about all this sadness for awhile, huh?""
 'Sounds great!']",['Terrance' 'Taylan' 'Terrance' 'Taylan' 'Terrance' 'Taylan'],Terrance,Taylan,,1492900,train,Yes,Yes,Yes,Yes
189,PersonX makes PersonY's way smooth,xNeed,to make PersonY feel better,Dorothea made Hyrum feel better. Dorothea makes Hyrum's way smooth.,Dorothea makes Hyrum feel better. Dorothea helps Hyrum by taking away some of his workload. Dorothea is always willing to lend a listening ear and gives great advice.,"[""Hey, Hyrum. You seem like you're having a tough day.""
 ""Yeah, I'm just feeling really overwhelmed with everything right now.""
 ""I completely understand. It can be really tough trying to juggle everything. But you're not alone. I'm here for you and I want to help in any way I can.""
 'Thank you, Dorothea. Just knowing that I have someone to talk to who understands makes me feel a little better already.'
 ""Of course! That's what friends are for. So let's talk about what's going on and see if we can figure out a plan to make things more manageable for you.""
 'Okay.' ""So, what's been the most stressful part of your day?""]",['Dorothea' 'Hyrum' 'Dorothea' 'Hyrum' 'Dorothea' 'Hyrum' 'Dorothea'],Dorothea,Hyrum,,1496685,train,Yes,Yes,Yes,Yes
190,PersonX waves a carrot at PersonY,xIntent,to make PersonY feel better,Davion waves a carrot at Anwar because Davion wants to make Anwar feel better.,"Davion sees that Anwar is looking sad, so she waves a carrot at him in an attempt to cheer him up.","[""Hey Anwar, what's up?"" 'Just feeling a little down today.'
 ""Aww, I'm sorry to hear that. Here, have a carrot.""
 ""Thanks, Davion. It's really nice of you to try and cheer me up.""
 ""Hey, that's what friends are for! So, what's been bothering you?""
 ""I don't know, just everything I guess. School has been stressful lately and I'm not sure what I want to do with my life after graduation.""
 'Yeah, I know how you feel. School can be tough sometimes. But as for your future plans, have you given any thought to what you might want to do?'
 ""Not really. I've been thinking about becoming a teacher or maybe working in environmental science. But I don't know if either of those are the right fit for me.""
 'Well, those both sound like great options! Have you talked to anyone else about your concerns?'
 ""Just my parents and they're not really helping much since they don't understand what I'm going through right now.""
 'Well, maybe we can brainstorm a bit and see if we can come up with some ideas together? Would that help at all?']","['Davion' 'Anwar' 'Davion' 'Anwar' 'Davion' 'Anwar' 'Davion' 'Anwar'
 'Davion' 'Anwar' 'Davion']",Davion,Anwar,,1504823,train,Yes,Yes,Yes,Yes
191,PersonX hands PersonY a drink,xIntent,to make PersonY feel better,Teaira hands Thor a drink because Teaira wants to make Thor feel better.,Teaira hands Thor a drink because Teaira wants to make Thor feel better. Teaira knows that Thor is feeling down because she just got dumped by her boyfriend. Teaira figures that a drink will help Thor forget about her ex and cheer her up.,"[""Hey, I saw what happened with you and Jake. I'm so sorry.""
 ""Thanks, Teaira. It sucks. I can't believe he would do that to me.""
 ""I know, it's really tough when something like that happens. But you'll get through it, I promise.""
 ""I don't know if I can. He was everything to me.""
 'Thor, listen to me. You are strong and beautiful and smart and you will find someone who appreciates all of those things about you. Jake is an idiot for not seeing how amazing you are.'
 'Thank you, Teaira. Just hearing you say that makes me feel a little better.'
 ""Good! Now let's forget about him and have some fun tonight, okay? Here, drink this and let's dance!""]",['Teaira' 'Thor' 'Teaira' 'Thor' 'Teaira' 'Thor' 'Teaira'],Teaira,Thor,,1505561,train,Yes,Yes,Yes,Yes
192,PersonX gives PersonY drugs,xIntent,to make PersonY feel better,Karan gives Chris drugs because Karan wants to make Chris feel better.,"Karan gave Chris a pill to make her feel better. The pill was small and white, and it made Chris feel calmer and more relaxed.","['So, how are you feeling?'
 ""I'm feeling better, thanks. The pill you gave me seems to be helping.""
 ""That's good. I'm glad it's helping.""
 'Yeah, me too. It was starting to get pretty overwhelming there for a while.'
 ""I can imagine. It sounds like you've been through a lot lately.""
 ""Yeah, I have. It's been tough, but I'm trying to stay positive and keep moving forward.""
 ""That's definitely the right attitude to have. things will get better with time, just keep pushing through and don't give up on yourself.""
 'Thank you, Karan. That means a lot coming from you']",['Karan' 'Chris' 'Karan' 'Chris' 'Karan' 'Chris' 'Karan' 'Chris'],Karan,Chris,,1536365,train,Yes,Yes,Yes,Yes
193,PersonX tells PersonY about the visit,xIntent,to make PersonY feel better,Jubilee tells Alyvia about the visit because Jubilee wants to make Alyvia feel better.,Jubilee tells Alyvia about the visit because Jubilee wants to make Alyvia feel better. Jubilee told Alyvia that he had seen Amanda and that she looked really happy. He also said that she had asked about Alyvia and wanted to know how he was doing.,"['Hey Alyvia. I wanted to come talk to you because I saw Amanda today.'
 'Oh yeah? How is she?'
 'She looked really happy. And she asked about you too, wanted to know how you were doing.'
 ""That's good to hear. I'm glad she's doing well.""
 'Yeah, me too. So, how are you holding up?'
 ""To be honest, I've been better. This whole situation has been really tough on me.""
 ""I can imagine. It's tough on all of us. But it sounds like Amanda is doing well, so that's something positive to focus on, right?""
 'Yeah, I guess so. Thanks for coming to talk to me Jubilee, it really means a lot.'
 ""Of course man, we're all here for you""]","['Jubilee' 'Alyvia' 'Jubilee' 'Alyvia' 'Jubilee' 'Alyvia' 'Jubilee'
 'Alyvia' 'Jubilee']",Jubilee,Alyvia,,1537482,train,Yes,Yes,Yes,Yes
194,PersonX relates with PersonY,xIntent,to make PersonY feel better,Melani relates with Rainey because Melani wants to make Rainey feel better.,Melani patted Rainey's back as Rainey cried. Melani felt terrible that his friend was upset and wanted to make him feel better. He offered comforting words and promised that everything would be alright.,"[""Hey, buddy, it's okay. I'm here for you.""
 ""I can't believe this is happening. It feels like a nightmare.""
 ""I know, but we'll get through it together. Everything will be alright.""
 ""But what if it isn't? What if this is the end of the world?""
 ""Rainey, look at me. The world isn't ending. We're going to get through this and come out stronger on the other side. Okay?""
 ""Okay… Melani… thank you… for being here for me… I don't know what I would do without you…""]",['Melani' 'Rainey' 'Melani' 'Rainey' 'Melani' 'Rainey'],Melani,Rainey,,1537995,train,Yes,Yes,Yes,Yes
195,PersonX presents PersonY with a broom,xIntent,to make PersonY feel better,Sophia presents Marvin with a broom because Sophia wants to make Marvin feel better.,Sophia presented Marvin with a broom as a gesture of goodwill. He wanted her to feel better after she had a tough day. The broom was a symbol of how Sophia wanted to help her with her difficulties.,"['Hey, I saw that you had a tough day today. I just wanted to give you this broom as a gesture of goodwill.'
 ""Oh, thank you. That's really sweet of you.""
 'Yeah, no problem. I just wanted to help out however I could.'
 ""You're really kind. I appreciate it.""
 'No problem at all. So, how are you doing?'
 ""I'm feeling a little better, thanks for asking.""
 ""That's good to hear. Let me know if there's anything else I can do to help you out.""
 'Thanks, Sophia. I appreciate it.']",['Sophia' 'Marvin' 'Sophia' 'Marvin' 'Sophia' 'Marvin' 'Sophia' 'Marvin'],Sophia,Marvin,,1544145,train,Yes,Yes,Yes,Yes
196,PersonX cried over PersonY,xIntent,to make PersonY feel better,Jonelle cried over Raven because Jonelle wants to make Raven feel better.,"Jonelle wanted to make Raven feel better, so she cried over her.","[""Hey, Raven. What's wrong?""
 ""I don't know. I just feel really down today.""
 ""That's tough. I'm here for you, though. Anything you want to talk about?""
 ""Not really. I just feel like life is really hard right now and I don't know how to make it better.""
 ""Oh, Raven. I'm so sorry. It sounds like you're going through a really tough time right now.""
 'Yeah, I am. But it feels good to be able to talk to you about it. Thank you for being here for me, Jonelle.'
 ""Of course! That's what friends are for! So, what can I do to help make your day better?""
 'Just being here with me and listening is helping a lot already. Thank you, Jonelle.']",['Jonelle' 'Raven' 'Jonelle' 'Raven' 'Jonelle' 'Raven' 'Jonelle' 'Raven'],Jonelle,Raven,,1549990,train,Yes,Yes,Yes,No
197,PersonX notices a scar on PersonY's foot,xWant,to make PersonY feel better,Amara notices a scar on Savannah's foot. Now Amara wants to make Savannah feel better.,Savannah notices a scar on Amara's foot that is about an inch long and is slightly raised. Now Savannah wants to make Amara feel better by asking him what happened and offering to help heal it if necessary.,"['Savannah, I noticed you were looking at my foot. Is something wrong?'
 ""No, nothing's wrong. I just noticed that you have a scar on your foot and I was wondering what happened.""
 ""Oh, this old thing? It's nothing, really. I got it when I was a kid. I was playing with some friends and we were climbing a tree. I slipped and fell and scraped my foot on a branch.""
 'That sounds like it must have hurt. Do you still have any pain from it?'
 'No, it healed up pretty quickly. But it does itch sometimes, especially when the weather is changing.'
 ""Well, if you ever need anything to help with the itch or the scar, let me know. I'm pretty good with herbs and healing things like that.""
 'Thank you, Savannah. That\'s very kind of you to offer.""'
 'So, how have you been since the accident?'
 ""I've been all right. The scar doesn't bother me too much, but like I said, it does itch sometimes.""
 'Do you ever use anything on it to help with the itch?'
 ""No, not really. I've tried a few things, but nothing seems to work very well.""
 'Well, maybe I can help you out with that. I know of a few things that might help ease the itchiness.'
 'Thank you, Savannah. That would be great.""']","['Amara' 'Savannah' 'Amara' 'Savannah' 'Amara' 'Savannah' 'Amara'
 'Savannah' 'Amara' 'Savannah' 'Amara' 'Savannah' 'Amara']",Amara,Savannah,,1557051,train,Unknown,No,No,No
198,PersonX reads to a blind PersonY,xIntent,to make PersonY feel better,Finnick reads to a blind Rachele because Finnick wants to make Rachele feel better.,"Finnick reads to Rachele because she wants him to feel better. She chooses books that she knows he will enjoy and reads them in a clear, friendly voice. She takes her time with the stories, pausing occasionally to explain what is happening in the pictures.","['Hey Rachele, how are you feeling today?'
 ""Not too good. My head hurts and I'm feeling a little nauseous.""
 ""I'm sorry to hear that. Do you want me to read to you for a little bit? I have some books here that I think you'll like.""
 'Sure, that would be great. Thank you.'
 ""Okay, let's see. I have 'The Cat in the Hat,' 'Green Eggs and Ham,' and 'The Very Hungry Caterpillar.' Which one would you like to hear first?""
 ""'Green Eggs and Ham' please.""
 ""Great choice! I love that book too. Okay, here we go. 'Do you like green eggs and ham?/I do not like them, Sam-I-am./I do not like green eggs and ham.'""]",['Finnick' 'Rachele' 'Finnick' 'Rachele' 'Finnick' 'Rachele' 'Finnick'],Finnick,Rachele,,1584898,train,Yes,No,Yes,Yes
199,PersonX explains PersonY’s mistake,xWant,to make PersonY feel better,Colyn explains Salem’s mistake. Now Colyn wants to make Salem feel better.,"“Colyn, why are you laughing?” “Salem, I’m not laughing at you. I’m just amused by your mistake. You see, the Maycomb Tribune only comes out once a week, on Wednesdays.”","['Why are you laughing, Salem?'
 ""I'm not laughing at you, Colyn. I'm just amused by your mistake. You see, the Maycomb Tribune only comes out once a week, on Wednesdays.""
 'Really? I had no idea.'
 ""Yeah, most people don't. But I always like to keep up with the news, so I make sure to get a copy every week.""
 ""That's very commendable, Salem. I must say that I'm impressed.""
 'Thanks, Colyn.']",['Colyn' 'Salem' 'Colyn' 'Salem' 'Colyn' 'Salem'],Colyn,Salem,,1588170,train,Yes,Yes,Yes,No
200,PersonX explains something about PersonY,xWant,to make PersonY feel better,Seleste explains something about Johndavid. Now Seleste wants to make Johndavid feel better.,Seleste explains that Johndavid is going to be a big sister. Now Seleste wants to make Johndavid feel better by giving her a hug.,"[""Hey Johndavid, I noticed you've been looking a little down lately. What's going on?""
 ""I'm just worried about becoming a big sister. I don't want to disappoint my parents.""
 ""Oh, honey, I'm sure you won't disappoint them. You're going to be a great big sister.""
 'Really? You think so?'
 ""Absolutely! And if you ever need any help or advice, I'm always here for you. Okay?""
 'Thanks, Seleste. That means a lot to me.']",['Seleste' 'Johndavid' 'Seleste' 'Johndavid' 'Seleste' 'Johndavid'],Seleste,Johndavid,,1588429,train,Yes,Yes,Yes,Yes
201,PersonX feels PersonY’s regret,xWant,to make PersonY feel better,Becky feels Aj’s regret. Now Becky wants to make Aj feel better.,Aj is sorry he didn't get to play with Becky. He wanted to play with him all day.,"[""Hey Aj, I'm sorry we didn't get to play together today.""
 'Yeah, I wanted to play with you all day.' 'Maybe we can play tomorrow?'
 'Yeah, that would be great!' ""I'll see you tomorrow then!""
 'See you tomorrow!']",['Becky' 'Aj' 'Becky' 'Aj' 'Becky' 'Aj'],Becky,Aj,,1593976,train,Yes,Yes,Yes,Yes
202,PersonX holds a light to PersonY's ear,xIntent,to make PersonY feel better,Cydnee holds a light to Kolin's ear because Cydnee wants to make Kolin feel better.,Cydnee holds a light to Kolin's ear because Cydnee wants to make sure that there is no water in his ear from swimming.,"[""Hey, let me check your ears real quick. I just want to make sure there's no water in them from swimming.""
 ""Yeah, that would be great. I haven't been feeling too well lately and I'm not sure if it's because of my ears or not.""
 ""Let me take a look. (He looks in Kolin's left ear) Nope, nothing in there. But let me check the other one just to be safe.""
 'Alright, thank you so much.'
 ""No problem buddy. (He looks in Kolin's right ear)Yep, nothing in there either. Your ears are good to go!""
 'Thank goodness. I was starting to get worried.'
 ""Don't worry about it, you're fine. Just make sure you dry your ears out after swimming from now on, okay?""
 'I will, thank you again.']",['Cydnee' 'Kolin' 'Cydnee' 'Kolin' 'Cydnee' 'Kolin' 'Cydnee' 'Kolin'],Cydnee,Kolin,,1603651,train,Yes,Yes,Yes,Yes
