,head,relation,tail,literal,narrative,dialogue,speakers,PersonX,PersonY,PersonZ,original_index,split,head_answer,pmi_head_answer,relation_tail_answer,pmi_relation_tail_answer
330,PersonX offers PersonY peace,xIntent,to make PersonY feel better,Jacquelin offers Braxten peace because Jacquelin wants to make Braxten feel better.,"Jacquelin offered Braxten peace because Jacquelin wanted to make Braxten feel better about himself. Specifically, Jacquelin thought that Braxten needed to feel better about his place in the world and in relation to other people.","[""Hey, Braxten. It's been a while since we talked.""
 ""Yeah, I know. I've been meaning to call you, but I've just been so busy.""
 'I understand. We all have our own lives to lead. But I wanted to talk to you because I think you need some peace in your life.'
 'Peace? What do you mean?'
 ""You seem like you're always stressing out and worried about something. And I just think that you need to relax and find some peace within yourself. Otherwise, you're going to end up making yourself sick with all this stress.""
 ""I don't know if I can just relax and find peace within myself. There's a lot going on in my life right now that's stressful.""
 'Yes, there are always going to be things in life that are stressful. But if you don\'t take the time for yourself to relax and find some peace, then those stressors are going to take over your life and control you instead of the other way around. You need to find a way to put them into perspective and not let them control you. That\'s what finding peace is all about. It\'s about taking back control of your life from whatever is stressing you out.""'
 ""I appreciate what you're saying, Jacquelin. And I know you're right. I do need to find some peace in my life. But it's just so hard when there's so much going on and I don't know how to relax and let go of all the stress.""
 ""Well, one thing you can try to do is take some time each day for yourself – even if it's just 10 or 15 minutes – to sit quietly and focus on your breath. Just breathe in and out slowly and focus on the present moment. Don't think about anything else other than your breathing. This can help you to clear your mind and start to feel more relaxed.""
 ""That does sound like it could help. I'm going to try it. Thank you, Jacquelin.""
 'You\'re welcome, Braxten. I just want you to be happy and at peace with yourself. That\'s all that matters to me.""']","['Jacquelin' 'Braxten' 'Jacquelin' 'Braxten' 'Jacquelin' 'Braxten'
 'Jacquelin' 'Braxten' 'Jacquelin' 'Braxten' 'Jacquelin']",Jacquelin,Braxten,,2716245,train,Yes,Yes,Yes,Yes
331,PersonX feels bad about PersonY,xWant,to make PersonY feel better,Jania feels bad about Davion. Now Jania wants to make Davion feel better.,"Jania felt bad about what had happened with Davion. He wanted to make things right, so he decided to apologize to Davion and offer to help him clean up the mess.","[""Hey, Davion. I wanted to apologize for what happened earlier. I know you were just trying to help and I shouldn't have gotten so mad.""
 ""It's okay, Jania. I understand why you were upset.""
 ""Yeah, I was really upset about the whole thing. But I shouldn't have taken it out on you. I'm sorry.""
 'Apology accepted. Thanks for understanding.'
 'No problem. Hey, do you want some help cleaning up the mess?'
 'That would be great, thanks!']",['Jania' 'Davion' 'Jania' 'Davion' 'Jania' 'Davion'],Jania,Davion,,2724234,train,Yes,Yes,Yes,Yes
332,PersonX writes a letter to PersonY,xIntent,to make PersonY feel better,Elanor writes a letter to Deirdre because Elanor wants to make Deirdre feel better.,"Elanor writes a letter to Deirdre because Elanor feels bad that Deirdre is going through a tough time. In the letter, Elanor tries to make Deirdre feel better by writing about all of the good times they have had together.","[""I'm sorry to hear that you're going through a tough time, Deirdre. I wanted to write you a letter and try to make you feel better by writing about all of the good times we have had together.""
 ""That's really sweet of you, Elanor. Thank you for thinking of me.""
 ""Of course! I always think of you. You're my best friend after all. We've been through so many good times together, it's impossible for me to pick just one favorite memory. But I'll try!""
 ""Yeah, those were definitely some good times. I'm glad we have those memories together. They make me feel a little better knowing that even though things are tough right now, there are still some good moments in my life too. Thanks for reminding me of that, Elanor.""
 ""You're welcome, Deirdre. I just wish I could do more to help you through this tough time.""
 ""Just knowing that you're thinking of me and supporting me means a lot, Elanor. Thank you for being such a great friend.""]",['Elanor' 'Deirdre' 'Elanor' 'Deirdre' 'Elanor' 'Deirdre'],Elanor,Deirdre,,2737963,train,Yes,Yes,Yes,Yes
333,PersonX gives PersonY a late night call,xIntent,to make PersonY feel better,Xavian gives Nevan a late night call because Xavian wants to make Nevan feel better.,"Nevan felt down, so Xavian called her to try and cheer her up. He asked her how her day was and she told him that it was fine. Xavian then proceeded to tell Nevan a joke, but she didn't find it funny.","[""I'm sorry that your day wasn't great. Here, let me try and cheer you up with a joke.""
 'Okay.' 'What do you call a snowman with a six-pack?'
 ""I don't know. What?""
 'An abdominal snowman! Get it? Because he has a six-pack!'
 ""Oh, I get it. That's actually really funny. Thanks for cheering me up, Xavian.""]",['Xavian' 'Nevan' 'Xavian' 'Nevan' 'Xavian' 'Nevan'],Xavian,Nevan,,2741680,train,Yes,Yes,Yes,Yes
334,PersonX gives PersonY a speech,xIntent,to make PersonY feel better,Kylea gives Brandin a speech because Kylea wants to make Brandin feel better.,"Brandin felt terrible about what had happened. Kylea wanted to make him feel better, so she gave him a speech about how everyone makes mistakes and it's not the end of the world.","['""Hey, Brandin. I\'m really sorry about what happened.""'
 '""I know. I feel terrible.""'
 '""It\'s not your fault. Everyone makes mistakes.""'
 '""I know, but it doesn\'t make me feel any better.""'
 '""Well, try to think of it this way. It\'s not the end of the world. You\'ll learn from this and become a better person.""'
 '""I hope so.""'
 '""I know so. You\'re a great person, Brandin. And I\'m here for you if you need to talk.""']",['Kylea' 'Brandin' 'Kylea' 'Brandin' 'Kylea' 'Brandin' 'Kylea'],Kylea,Brandin,,2746073,train,Yes,Yes,Yes,Yes
335,PersonX takes PersonY to a house,xIntent,to make PersonY feel better,Yadhira takes Kurt to a house because Yadhira wants to make Kurt feel better.,"Yadhira takes Kurt to a house on Elm Street because Yadhira wants to make Kurt feel better. The house is two stories with a wrap-around porch and is surrounded by a white picket fence. Inside, there is a warm fire burning in the fireplace and a comfortable couch for them to sit on.","[""So what's been going on? You seem really down lately.""
 ""I don't know, everything just feels so pointless. Like what's the point of even trying anymore?""
 ""Don't say that, Kurt. You're a smart, talented guy with a lot to offer. The world needs people like you.""
 'But what good am I doing? It feels like everything I do is for nothing.'
 ""That's not true and you know it. Even if it doesn't feel like it sometimes, what you do matters. You matter.""
 ""It's just so hard to keep going when it feels like everything is against you.""
 ""I know, but you're stronger than you think. You can get through this.""
 ""I don't know if I can.""
 'Yes, you can. I believe in you, Kurt. And I know that you can do this.']","['Yadhira' 'Kurt' 'Yadhira' 'Kurt' 'Yadhira' 'Kurt' 'Yadhira' 'Kurt'
 'Yadhira']",Yadhira,Kurt,,2753771,train,Yes,Yes,Unknown,No
336,PersonX makes light of PersonY's awkwardness,xIntent,to make PersonY feel better,Caius makes light of Jeanine's awkwardness because Caius wants to make Jeanine feel better.,"Caius makes fun of Jeanine's awkwardness because Caius wants to make Jeanine feel better about himself. Caius knows that Jeanine is always the last one picked for teams and sometimes gets made fun of by other kids, so he wants to show Jeanine that he is accepted and liked by making light of his awkwardness.","['Hey Jeanine, why are you so awkward?' ""I don't know. I just am.""
 ""Well, it's not a bad thing. It just means you're unique."" 'I guess so.'
 ""And that's a good thing! Being different is what makes life interesting. If everyone was the same, the world would be boring.""
 'I never thought of it that way before. Thanks, Caius!']",['Caius' 'Jeanine' 'Caius' 'Jeanine' 'Caius' 'Jeanine'],Caius,Jeanine,,2754965,train,Yes,Yes,Yes,Yes
337,PersonX is talking with PersonY,xIntent,to make PersonY feel better,Railynn is talking with Daquan because Railynn wants to make Daquan feel better.,"Railynn saw Daquan sitting by herself at lunch and went over to sit with her. ""Hey, are you okay?"" Railynn asked.","['Hey, are you okay?'
 ""Yeah, I'm fine. Just a little tired, I didn't sleep well last night.""
 ""Oh, I'm sorry to hear that. What was keeping you up?""
 'Just some things on my mind, nothing major.'
 ""Well if you ever want to talk about it, I'm here for you. I know how it feels to have something on your mind and not be able to sleep.""
 'Thanks, Railynn. I appreciate that.']",['Railynn' 'Daquan' 'Railynn' 'Daquan' 'Railynn' 'Daquan'],Railynn,Daquan,,2803953,train,Yes,Yes,Yes,Yes
338,PersonX makes a fuss over PersonY,xIntent,to make PersonY feel better,Quaid makes a fuss over Anaisha because Quaid wants to make Anaisha feel better.,"Anaisha is sad because he lost his basketball game. Quaid comes over and says, ""It's okay, Anaisha. You'll win the next one."" Quaid gives Anaisha a hug and makes him feel better.","[""Hey, Anaisha. I saw that you lost your basketball game. I'm really sorry about that.""
 ""Thanks, Quaid. It was a tough loss. I can't believe we let the other team come back like that.""
 ""Yeah, it sucks when you lose like that. But don't worry, you'll win the next one.""
 'I hope so. I really wanted to win this one though. It would have been a great way to start the season off.'
 ""Yeah, but like they say, there's always next time. And you're a great player, so I'm sure you'll bounce back and win the next game. Just keep your head up and stay positive""
 'Thanks, Quaid. I appreciate your support.'
 ""No problem, Anaisha. That's what friends are for.""]",['Quaid' 'Anaisha' 'Quaid' 'Anaisha' 'Quaid' 'Anaisha' 'Quaid'],Quaid,Anaisha,,2805376,train,Yes,Yes,Yes,Yes
339,PersonX tells PersonY about his friends,xIntent,to make PersonY feel better,Avia tells Sharif about his friends because Avia wants to make Sharif feel better.,Avia told Sharif about his friends because Avia wanted to make Sharif feel better. Avia said that his friends were always there for him and that they would never leave him. Sharif felt better after hearing this and thanked Avia for telling him.,"['Hey, Sharif. I wanted to tell you something that might make you feel better.'
 'What is it?'
 ""Well, you know how you're always saying that you feel like your friends don't really care about you and that they'll leave you eventually?""
 'Yeah...'
 ""I just wanted to let you know that my friends are always there for me, no matter what. And I know they would never leave me. So, if you ever need someone to talk to, I'm always here for you too, okay?""
 'Thanks, Avia. That means a lot to me.']",['Avia' 'Sharif' 'Avia' 'Sharif' 'Avia' 'Sharif'],Avia,Sharif,,2814573,train,Yes,Yes,Yes,Yes
340,PersonX appears to PersonY,xIntent,to make PersonY feel better,Turner appears to Tessa because Turner wants to make Tessa feel better.,"Turner appears to Tessa as a white light because she wants to make her feel better. Turner has been with Tessa since she was born, and will always be with her. She is there to protect and guide her.","['Hey there, kiddo.' 'Hey...what are you?' ""I'm your guardian angel.""
 'Why are you a white light?' 'Because it makes you feel better.'
 'But why?' ""Because it's what you need right now.""]",['Turner' 'Tessa' 'Turner' 'Tessa' 'Turner' 'Tessa' 'Turner'],Turner,Tessa,,2849077,train,Yes,Yes,Yes,Yes
341,PersonX and PersonY lie down together on the ground,xIntent,to make PersonY feel better,Maliyah and Amoura lie down together on the ground because Maliyah wants to make Amoura feel better.,Maliyah lies down on the ground next to Amoura in order to console her. Amoura feels better knowing she is not alone and has someone to lean on.,"[""Hey, it's okay. I'm here for you."" 'I know. Thank you.' ""What's wrong?""
 'Just feeling a little down, I guess.' 'Do you want to talk about it?'
 'Not really.'
 ""That's okay. Sometimes it helps to talk about what's bothering us, but sometimes it doesn't.""
 ""Yeah, I know. It's just...I don't really know what to say.""
 ""Well, why don't we start with how your day was?""]","['Maliyah' 'Amoura' 'Maliyah' 'Amoura' 'Maliyah' 'Amoura' 'Maliyah'
 'Amoura' 'Maliyah']",Maliyah,Amoura,,2859803,train,Yes,Yes,Yes,No
342,PersonX accidentally spills hot coffee on PersonY,xWant,to make PersonY feel better,Ishani accidentally spills hot coffee on Haylee. Now Ishani wants to make Haylee feel better.,Ishani accidentally spilled hot coffee on Haylee's leg. Ishani felt awful and quickly got a towel to help Haylee clean up. She also brought Haylee a cold drink and apologized profusely for the accident.,"[""I'm so sorry about that. Are you okay?""
 ""Yeah, I'm fine. It was just a little coffee.""
 'I feel terrible. Let me get you a towel to clean up.' 'Thanks.'
 ""And here's a cold drink for your leg. I'm really sorry about this.""
 ""It's no big deal, really. accidents happen.""
 'I know, but I still feel bad.' ""Don't worry about it. I'm fine.""]",['Ishani' 'Haylee' 'Ishani' 'Haylee' 'Ishani' 'Haylee' 'Ishani' 'Haylee'],Ishani,Haylee,,2865125,train,Yes,Yes,Yes,Yes
343,PersonX cleans PersonY's skin,xWant,to make PersonY feel better,Citlaly cleans Leonel's skin. Now Citlaly wants to make Leonel feel better.,"Citlaly cleans Leonel's skin with a cloth. Now Citlaly wants to make Leonel feel better, so he puts on some lotion and gives him a big hug.","['Hey, Leonel. I just wanted to clean your skin and put some lotion on it. I hope that makes you feel better.'
 'Yeah, it does. Thank you, Citlaly.'
 ""Anytime. I just want to make sure you're feeling better. So, how are you doing?""
 ""I'm doing alright. Just a little shaken up, you know?""
 'Yeah, I can imagine. It must have been really scary.'
 'It was. I thought I was going to die for sure.'
 ""But you're here now and that's what matters. You're safe now.""
 ""Yeah...I guess you're right.""
 ""Of course I am. Now, why don't we get you some water or something to drink? You must be thirsty after all that running around.""
 'Yeah, that would be great actually. Thank you, Citlaly.']","['Citlaly' 'Leonel' 'Citlaly' 'Leonel' 'Citlaly' 'Leonel' 'Citlaly'
 'Leonel' 'Citlaly' 'Leonel']",Citlaly,Leonel,,2866932,train,Yes,Yes,Yes,Yes
344,PersonX grabs PersonY's shoulders,xIntent,to make PersonY feel better,Brieana grabs Soleil's shoulders because Brieana wants to make Soleil feel better.,"Brieana tries to make Soleil feel better by grabbing her shoulders and shaking her slightly. ""It's going to be alright,"" Brieana says in a soft, reassuring voice. ""I'm here for you.""","[""It's going to be alright. I'm here for you.""
 'I know, I just feel so lost right now.'
 ""You're not lost, I promise. We'll figure this out together.""
 ""But what if we can't?""
 ""We will. I won't let anything happen to you, I promise.""]",['Brieana' 'Soleil' 'Brieana' 'Soleil' 'Brieana'],Brieana,Soleil,,2872887,train,Yes,Yes,Yes,Yes
345,PersonX scratches PersonY’s back,xIntent,to make PersonY feel better,Delainey scratches Anwar’s back because Delainey wants to make Anwar feel better.,"Anwar feels itchy all over her back, so she asks Delainey to scratch it for her. Delainey happily obliges, scratching Anwar's back with long, gentle strokes. It feels good, and soon Anwar is feeling much better.","[""I'm glad I could help scratch your back, Anwar.""
 ""Yeah, it felt really good. I've been feeling itchy all over lately and it's been driving me crazy.""
 'Have you seen a doctor about it?'
 ""No, I don't think it's anything serious. I think it's just dry skin or something.""
 ""Well, if you're not sure, maybe you should get it checked out just to be safe.""
 ""Yeah, maybe you're right. I'll make an appointment with the doctor next week. Thanks for being concerned, Delainey.""]",['Delainey' 'Anwar' 'Delainey' 'Anwar' 'Delainey' 'Anwar'],Delainey,Anwar,,2890531,train,Yes,Yes,Yes,No
346,PersonX assures PersonY of it,xIntent,to make PersonY feel better,Neela assures Cristopher of it because Neela wants to make Cristopher feel better.,"Neela told Cristopher that she was sure he would do great on his test tomorrow. She said that he was smart and had studied hard, so there was no reason for him to worry. Neela's words made Cristopher feel better, and he thanked her before going to bed.","[""I'm sure you'll do great on your test tomorrow. You're smart and you've studied hard, so there's no reason for you to worry.""
 'Thank you, Neela. Just hearing you say that makes me feel better.'
 'Of course! I believe in you, and I know you can do it.'
 ""Yeah...I guess you're right. I just need to relax and trust myself.""
 'Exactly! You got this!'
 'Thanks, Neela. I feel better now. Good luck on your own test tomorrow.'
 ""You too! I know you'll do great.""]",['Neela' 'Cristopher' 'Neela' 'Cristopher' 'Neela' 'Cristopher' 'Neela'],Neela,Cristopher,,2892305,train,Yes,Yes,Yes,Yes
347,PersonX explains why PersonY is sick,xWant,to make PersonY feel better,Halima explains why Keagan is sick. Now Halima wants to make Keagan feel better.,Halima is worried about his friend Keagan. Keagan has a fever and Halima wants to make him feel better. He gets a glass of water and a wet cloth to put on Keagan's forehead.,"['Hey, Keagan. How are you feeling?'
 'Not great. My head is pounding and I feel really hot.'
 'Here, let me take a look. Wow, you definitely have a fever. Do you want some water?'
 'Yeah, that would be great.' 'Here you go. Drink up.' 'Thank you.'
 'No problem, buddy. I just want you to feel better.'
 ""I appreciate it. I think I'm going to lie down for a bit though.""
 'Okay, let me know if you need anything else.']","['Halima' 'Keagan' 'Halima' 'Keagan' 'Halima' 'Keagan' 'Halima' 'Keagan'
 'Halima']",Halima,Keagan,,2916500,train,Unknown,No,Yes,Yes
348,PersonX asks PersonY to bathe,xIntent,to make PersonY feel better,Yair asks Poppy to bathe because Yair wants to make Poppy feel better.,"Yair asks Poppy to bathe because Yair wants to make Poppy feel better. Specifically, Yair wants Poppy to feel more relaxed and less anxious. Yair believes that a warm bath will help Poppy to achieve this goal.","[""Hi, Poppy. I hope you're feeling better today.""
 ""Yeah, I'm doing all right. Thanks for asking.""
 ""That's good to hear. Listen, I was thinking… maybe a warm bath would make you feel even better?""
 ""A bath? I don't know…""
 'It might help you relax and feel less anxious. Plus, it would be nice to just soak in some warm water for a while.'
 'Okay, sure. Why not? Thanks for the suggestion, Yair.']",['Yair' 'Poppy' 'Yair' 'Poppy' 'Yair' 'Poppy'],Yair,Poppy,,2947287,train,Yes,Yes,Yes,Yes
349,PersonX thinks PersonY is in too much pain,xWant,to make PersonY feel better,Bernice thinks Jeremy is in too much pain. Now Bernice wants to make Jeremy feel better.,Bernice looked at Jeremy and felt terrible that he was in so much pain. She wanted to do something to help make him feel better. She got him a glass of water and a pillow to help him get comfortable.,"['Hey, Jeremy. Are you feeling okay?' ""Not really. I'm in a lot of pain.""
 ""I'm so sorry. Is there anything I can do to help make you feel better?""
 'Just being here with me is helping a lot. Thank you.'
 ""Of course. I'm happy to be here for you. Do you want me to get you anything? Some water or a pillow?""
 ""Water would be great, thank you. And a pillow would be nice too, if you don't mind getting one for me.""
 ""No problem at all. I'll be right back with those things for you.""
 ""Thank you so much, Bernice. You're really sweet.""
 'I just want to help make you feel better.'
 ""You're doing a great job. Just being here with me is making me feel a lot better already.""
 ""I'm glad I can be here for you. Do you want to talk about what's going on?""
 ""It's just been a really tough week. My grandma died and it's been really hard for me to deal with.""
 ""Oh, Jeremy, I'm so sorry to hear that. That must be really tough for you.""
 ""Yeah, it is. But I know she's in a better place now and I'm trying to take comfort in that.""]","['Bernice' 'Jeremy' 'Bernice' 'Jeremy' 'Bernice' 'Jeremy' 'Bernice'
 'Jeremy' 'Bernice' 'Jeremy' 'Bernice' 'Jeremy' 'Bernice' 'Jeremy']",Bernice,Jeremy,,2965826,train,Yes,Yes,Yes,Yes
350,PersonX shows a friendly gesture to PersonY,xIntent,to make PersonY feel better,Bryleigh shows a friendly gesture to America because Bryleigh wants to make America feel better.,"Bryleigh held out his hand to America and smiled. He could see that she was really upset and he wanted to make her feel better. ""It's going to be okay,"" he said in a soft, comforting voice.","[""Hi, America. It's going to be okay.""
 ""I don't know, Bryleigh. I'm really upset and I don't know if I can trust you anymore.""
 'What happened? What made you so upset?'
 'You lied to me, Bryleigh. You said that you loved me and that we would be together forever, but then you left me. You just up and left without even saying goodbye.'
 ""America, I'm sorry. I never meant to hurt you. I was young and stupid and I made a mistake. But I still love you, America. I never stopped loving you.""
 ""But why did you leave? Why didn't you say goodbye?""
 'To be honest, America, I was scared. Scared of what our future might hold if we stayed together. But looking back now, I realize that leaving was the wrong thing to do and that I should have told you how much I loved you before leaving.']",['Bryleigh' 'America' 'Bryleigh' 'America' 'Bryleigh' 'America' 'Bryleigh'],Bryleigh,America,,2969255,train,Yes,Yes,No,No
351,PersonX begs PersonY to talk,xIntent,to make PersonY feel better,Romy begs Alvin to talk because Romy wants to make Alvin feel better.,Romy wants to make Alvin feel better by talking to her. Romy hopes that talking will help Alvin feel better about the situation.,"[""Hi, Alvin. I'm so sorry about what happened.""
 ""It's not your fault, Romy.""
 'I know, but I still feel terrible. Is there anything I can do to help you feel better?'
 'Just talking to you is helping me feel a little better. Thank you for being here for me.'
 ""Of course, Alvin. I'll always be here for you."" 'I know.'
 'Do you want to talk about what happened?'
 ""Not really. It's just so painful to think about.""
 ""I understand. If you ever do want to talk about it, I'm here for you.""
 'Thank you, Romy.']","['Romy' 'Alvin' 'Romy' 'Alvin' 'Romy' 'Alvin' 'Romy' 'Alvin' 'Romy'
 'Alvin']",Romy,Alvin,,3000846,train,Yes,Yes,No,No
352,PersonX says hello to PersonY,xIntent,to make PersonY feel better,Oden says hello to Braidyn because Oden wants to make Braidyn feel better.,"Braidyn looks sad, so Oden says hello to him in an attempt to make him feel better. Braidyn thanks her and they chat for a bit before going their separate ways.","['Hi, Braidyn. How are you doing today?'
 ""I'm all right, I guess. Thanks for talking to me.""
 ""No problem! I like talking to you. So what's been going on?""
 'Just the usual, I guess. School and stuff.'
 ""Yeah, school can be tough sometimes. But it's important to keep your head up and stay positive!""
 ""That's easier said than done... but I appreciate the sentiment nonetheless.""]",['Oden' 'Braidyn' 'Oden' 'Braidyn' 'Oden' 'Braidyn'],Oden,Braidyn,,3000978,train,Yes,Yes,Yes,Yes
353,PersonX gives PersonY a shower,xIntent,to make PersonY feel better,Dashaun gives Baruch a shower because Dashaun wants to make Baruch feel better.,"Dashaun turned on the shower and helped Baruch into the tub. She washed his hair and body, making sure to be extra gentle around his bruises. When he was clean, she wrapped him in a warm towel and rubbed his back until he relaxed.","['Are you feeling any better?' 'Yeah, I think so. That feels really good.'
 ""Good. I'm glad.""
 'So, what happened? The last thing I remember is being in the car with you and then I woke up here.'
 ""We were in a car accident. You hit your head pretty hard and you've been unconscious ever since. But the doctors say you're going to be okay.""
 'Thank goodness. And you? Are you all right?'
 ""Yeah, I'm fine. A little bruised up, but nothing serious.""
 ""That's a relief. So, what now?""
 'Well, the doctors want to keep you overnight for observation, but they said you can go home tomorrow if everything looks good.'
 ""That's good news. I'm just glad you're okay."" 'Me too.']","['Dashaun' 'Baruch' 'Dashaun' 'Baruch' 'Dashaun' 'Baruch' 'Dashaun'
 'Baruch' 'Dashaun' 'Baruch' 'Dashaun']",Dashaun,Baruch,,3017615,train,Yes,Yes,No,No
