,head,relation,tail,literal,narrative,dialogue,speakers,PersonX,PersonY,PersonZ,original_index,split,head_answer,pmi_head_answer,relation_tail_answer,pmi_relation_tail_answer
507,PersonX's thought is directed at PersonY,xIntent,to make PersonY feel better,Alanis' thought is directed at Jancarlos because Alanis wants to make Jancarlos feel better.,Alanis told Jancarlos about a time when she was in a tough spot and how she got through it. She reassured Jancarlos that she was strong and could get through this too.,"[""I remember when I was in a tough spot once. I felt like I had nowhere to turn and no one to help me. But I got through it. I'm stronger now because of it.""
 'How did you get through it? What did you do?'
 ""It wasn't easy, but I just kept going. I told myself that I could get through anything if I just kept moving forward. And eventually, things started getting better. It takes time, but things will get better for you too, Jancarlos. Just keep going and don't give up on yourself.""
 'Thank you, Alanis. That means a lot to me.'
 ""I'm glad I could help, Jancarlos. Remember, you're strong and you can get through this. Just keep moving forward one day at a time.""]",['Alanis' 'Jancarlos' 'Alanis' 'Jancarlos' 'Alanis'],Alanis,Jancarlos,,4464752,train,Yes,Yes,Yes,Yes
508,PersonX fills PersonY's head with dreams,xIntent,to make PersonY feel better,Liv fills Makaio's head with dreams because Liv wants to make Makaio feel better.,Liv tells Makaio about a party that he went to where there was a huge cake. The cake was so big that it took up the whole table. Liv says that everyone at the party was eating slices of the cake and that it was really delicious.,"['Hey Makaio, I wanted to tell you about the party I went to last weekend. There was this huge cake that took up the whole table. It was really delicious and everyone at the party was eating slices of it.'
 ""Wow, that sounds like it was a really great party! I'm so jealous that I didn't get to go. What kind of cake was it?""
 ""It was a chocolate cake with chocolate frosting. It was so rich and moist. I'm sure you would have loved it.""
 ""That does sound really delicious. I'm definitely going to have to try to get my hands on some of that cake next time. Thanks for letting me know about the party, Liv!""]",['Liv' 'Makaio' 'Liv' 'Makaio'],Liv,Makaio,,4470217,train,Yes,Yes,No,No
509,PersonX and PersonY share a drink,xIntent,to make PersonY feel better,Davien and Eunice share a drink because Davien wants to make Eunice feel better.,Davien and Eunice are at the bar. Davien buys Eunice a drink and they talk for a while. Eunice feels better after talking to Davien.,"[""So what's been going on?""
 ""Just the usual, I guess. Work's been stressful, my relationship is kind of on the rocks...""
 'Yeah, I know how that feels. My job has been crazy lately too. And my boyfriend and I are also having some problems.'
 ""It's just hard when you feel like you're not really sure where things are going, you know?""
 ""Absolutely. It's like you're just holding on and hoping for the best but not really knowing what to expect.""
 ""Exactly! And then when things don't go the way you want them to, it's just so frustrating and disappointing.""
 ""Yeah, I totally get that. But sometimes things happen for a reason, even if we don't understand it at the time. So maybe this is all happening for a reason that will eventually become clear to you.""
 ""That's a good way to look at it. Thanks for talking to me, Davien. I feel better already.""]",['Davien' 'Eunice' 'Davien' 'Eunice' 'Davien' 'Eunice' 'Davien' 'Eunice'],Davien,Eunice,,4470875,train,Yes,Yes,Yes,No
510,PersonX invites PersonY out for coffee,xIntent,to make PersonY feel better,Damond invites Eliazar out for coffee because Damond wants to make Eliazar feel better.,Damond invites Eliazar out for coffee to Starbucks. She gets a grande iced caramel macchiato while Eliazar gets a Pike Place Roast. They sit down at a table near the window and chat.,"[""Hey Eliazar, thanks for meeting me here! How's your day going?""
 ""It's going good. I'm just getting off work and thought I could use a coffee. How about you?""
 ""I'm doing well, thanks. I just had a busy morning and needed a pick-me-up. This is my favorite drink here, the iced caramel macchiato. What did you get?""
 ""The Pike Place Roast is really good too. I'm not much of a coffee person though, so I only get it every once in awhile. But it's nice to have something warm to drink on a cold day like today.""
 ""Yeah, it is cold today! I'm glad we decided to meet inside. So, what did you want to talk about?""
 ""Well, I've been thinking about what you said the other day, about how you're not sure if you want to go to college or not. And I just wanted to talk to you more about it and see if there's anything I can do to help.""
 ""That's really sweet of you, Eliazar. I appreciate it. I'm still not sure what I want to do, but talking to you has helped me a lot. Just hearing your opinion and getting some advice has been really helpful.""
 ""Yeah, no problem. Like I said before, I think college is a great opportunity and I think you should definitely consider it. But ultimately the decision is up to you and whatever makes you happy is what's important.""
 ""That's a really good way of looking at it. Thank you for your help, Eliazar. I think I'm going to go home and think about it some more. But I'll let you know what I decide soon.""
 'Sounds good! Thanks for meeting with me, Damond. Have a good night!']","['Damond' 'Eliazar' 'Damond' 'Eliazar' 'Damond' 'Eliazar' 'Damond'
 'Eliazar' 'Damond' 'Eliazar']",Damond,Eliazar,,4481967,train,Yes,Yes,No,No
511,PersonX shows PersonY the error of her ways,xIntent,to make PersonY feel better,Rebel shows Lilyann the error of her ways because Rebel wants to make Lilyann feel better.,"Rebel showed Lilyann the error of her ways by explaining to Lilyann that what she was doing was wrong and that she should feel bad about it. Rebel wanted to make Lilyann feel better, so he helped her see the error of her ways.","[""You know, what you're doing is wrong. You should feel bad about it.""
 ""I don't know what you're talking about.""
 ""You're being mean to your sister and she doesn't deserve it.""
 ""So what? She's always mean to me!""
 ""That's no excuse. Two wrongs don't make a right. You need to apologize to her and try to make things right.""
 ""But she'll just do it again next time!""
 ""Not if you set a good example and show her that you're sorry. Come on, it's the right thing to do.""
 ""Fine, I'll apologize to her but I don't think it will do any good.""]",['Rebel' 'Lilyann' 'Rebel' 'Lilyann' 'Rebel' 'Lilyann' 'Rebel' 'Lilyann'],Rebel,Lilyann,,4492461,train,Yes,Yes,No,No
512,PersonX sees that PersonY is crying,xWant,to make PersonY feel better,Waylon sees that Raul is crying. Now Waylon wants to make Raul feel better.,Waylon sees Raul crying. Waylon asks Raul what is wrong and Raul tells Waylon that she is having a bad day. Waylon wants to make Raul feel better so she gives her a hug and tells her that it will be alright.,"[""Hey, it's okay. What's wrong?""
 ""I don't know. I just had a really bad day.""
 'Do you want to talk about it?'
 ""I don't know. I just feel really down and frustrated.""
 ""Well, let's talk about it then. Maybe it will make you feel better.""
 'Okay.' 'So what happened today?'
 ""Everything was just going wrong. My alarm didn't go off so I was late for my first class, then I lost my phone so I couldn't call my mom, and then I got a bad grade on my test...""
 ""Oh, that sounds rough. But it's not like everything went wrong, right? You made it to your classes and you'll find your phone eventually. And as for the test grade, maybe you can talk to your professor about what you missed or what you can do to raise your grade next time.""
 ""Yeah, I guess you're right. It's just been a really tough day.""
 'Well, hopefully tomorrow will be better. And if not, we can always talk again. I\'m here for you no matter what.""']","['Waylon' 'Raul' 'Waylon' 'Raul' 'Waylon' 'Raul' 'Waylon' 'Raul' 'Waylon'
 'Raul' 'Waylon']",Waylon,Raul,,4498103,train,Yes,Yes,Yes,Yes
513,PersonX says PersonY does not feel well,xWant,to make PersonY feel better,Dashaun says Aaron does not feel well. Now Dashaun wants to make Aaron feel better.,Dashaun feels that Aaron does not feel well. Dashaun wants to help make Aaron feel better by getting her a drink of water and a blanket.,"[""Aaron, are you feeling okay? You don't look so well.""
 ""I'm not sure. I feel a little dizzy and lightheaded.""
 'Here, let me get you a drink of water and a blanket. Maybe that will help.'
 ""Thank you, Dashaun. That's very kind of you.""
 ""Of course, anything for my best friend. Let me just go grab those things for you real quick. I'll be right back!""
 'Thank you so much, Dashaun. I appreciate it.'
 ""No problem at all. I just want to make sure you're feeling better. Let me know if there's anything else I can do for you.""]",['Dashaun' 'Aaron' 'Dashaun' 'Aaron' 'Dashaun' 'Aaron' 'Dashaun'],Dashaun,Aaron,,4502640,train,Yes,Yes,Yes,Yes
514,PersonX sends PersonY an e-mail,xIntent,to make PersonY feel better,Haily sends Debra an e-mail because Haily wants to make Debra feel better.,"Haily sends Debra an e-mail because Haily feels that Debra has been going through a tough time recently. In the e-mail, Haily expresses his sympathy for what Debra is going through and offers his support.","['Hey Debra,'
 ""Thanks, Haily. It means a lot to me that you're here for me. I really appreciate it.""
 ""Of course, man. I'm always here for you. You know that.""
 ""Yeah, I know. But sometimes I feel like I'm a burden to you guys.""
 ""Debra, you're never a burden to us. We love you and we want to help you through this tough time.""
 'Thanks, Haily. That means a lot to me.']",['Haily' 'Debra' 'Haily' 'Debra' 'Haily' 'Debra'],Haily,Debra,,4510088,train,Yes,Yes,Yes,Yes
515,PersonX goes inside PersonY,xIntent,to make PersonY feel better,Cortez goes inside Idalia because Cortez wants to make Idalia feel better.,"Cortez went inside Idalia to make him feel better. She hugged him and kissed his cheek, then whispered, ""I'm here for you.""","[""Hey, it's okay. I'm here for you.""
 ""I don't know what to do. Everything feels so hopeless.""
 ""Well, let's start with what's going on. What's been happening that's got you feeling this way?""
 ""It's just everything. My job, my relationships, everything feels like it's falling apart and I can't do anything to stop it.""
 ""Okay, well let's take a step back then and look at each thing individually. What specifically is going on with your job?""
 ""I just feel like I'm not good enough, like I'm not doing anything right. My boss is always yelling at me and my co-workers are better than me. I don't know how much longer I can keep this up.""
 ""Okay, that definitely sounds tough. But it sounds like you're doing the best you can given the circumstances. And you know what? Even if things don't work out with your current job, there are other opportunities out there. You're smart and capable, so don't sell yourself short. As for your relationships, what's going on there?""
 ""It just feels like everyone is moving on without me. My friends are all getting married and having kids while I'm still single and stuck in the same place. It feels like they're all moving forward while I'm stuck in neutral""]",['Cortez' 'Idalia' 'Cortez' 'Idalia' 'Cortez' 'Idalia' 'Cortez' 'Idalia'],Cortez,Idalia,,4528536,train,Yes,Yes,No,Yes
516,PersonX made it easier for PersonY to trust her,xNeed,to make PersonY feel better,Kadynce made Ella feel better. Kadynce made it easier for Ella to trust her.,Ella felt better after talking to Kadynce. Kadynce made it easier for Ella to trust her because she was so understanding and supportive.,"['Hey, Ella. How are you doing?'
 ""I'm doing alright, Kadynce. Thanks for asking.""
 ""That's good to hear. So, what's been going on with you lately?""
 'Not much. Just the usual stuff, I guess. You know how it is.'
 'Yeah, I do. But it sounds like there might be something more on your mind than just the usual stuff. Is everything okay?'
 ""Yeah, everything's fine. I'm just a little stressed out about some things, that's all.""
 ""Do you want to talk about it? I'm here for you if you need to talk.""
 ""Thanks, Kadynce. I appreciate that. It's just been a tough few weeks, that's all.""
 ""First of all, my mom has been really sick and it's been worrying me a lot.""
 ""Oh, Ella, I'm so sorry to hear that. Is she going to be okay?""
 ""Yeah, the doctors say she's going to be fine. But it's been hard seeing her like that.""
 ""Of course it has. It's natural for you to feel worried and scared when someone you love is sick.""
 ""Yeah. And on top of that, I've just been having a lot of trouble in school lately.""
 'What kind of trouble?'
 ""Well, my grades have been slipping and I'm really not doing as well as I know I can do. And my teacher keeps giving me a hard time about it.""
 ""That sounds like a difficult situation to be in. Have you talked to your teacher about how you're feeling?""
 'Yeah, but it doesn\'t seem like she really cares or wants to help me out at all. She just keeps telling me that I need to try harder and do better."" Kadynce pauses for a moment before responding ""It sounds like you\'re feeling pretty frustrated right now.""']","['Kadynce' 'Ella' 'Kadynce' 'Ella' 'Kadynce' 'Ella' 'Kadynce' 'Ella'
 'Ella' 'Kadynce' 'Ella' 'Kadynce' 'Ella' 'Kadynce' 'Ella' 'Kadynce'
 'Ella']",Kadynce,Ella,,4543647,train,Yes,Yes,Yes,Yes
517,PersonX lets PersonY go through,xIntent,to make PersonY feel better,Ahana lets Bernadette go through because Ahana wants to make Bernadette feel better.,"Ahana likes to make people feel better, so she let Bernadette go through.","['Hey, are you okay?' 'Yeah, I just feel really down today.'
 ""I'm sorry to hear that. What's going on?""
 ""Just feeling really stressed out and overwhelmed. I don't know how to make it all go away.""
 ""Do you want to talk about it? I'm here for you.""
 ""Yeah, I guess so. It's just been a really tough week and everything feels like it's piling up on me.""
 ""I completely understand. It sounds like you're feeling really frustrated and helpless right now.""
 ""Yeah, that's exactly how I feel. Like no matter what I do, it's not enough and things just keep getting worse.""
 ""Well, let's see if we can figure out a plan together then. What do you think would help you feel better in the short-term?""
 'Just having someone to talk to who understands is really helping already, thank you.'
 ""Of course, anytime! In the meantime, why don't we brainstorm a few things that might help reduce your stress in the long-term? Would that be okay?""]","['Ahana' 'Bernadette' 'Ahana' 'Bernadette' 'Ahana' 'Bernadette' 'Ahana'
 'Bernadette' 'Ahana' 'Bernadette' 'Ahana']",Ahana,Bernadette,,4568258,train,Yes,Yes,Yes,Yes
518,PersonX and PersonY hug for the first time,xIntent,to make PersonY feel better,Lauro and Kallen hug for the first time because Lauro wants to make Kallen feel better.,"Lauro and Kallen hug because Lauro wants to make Kallen feel better. They have never hugged before, but it feels natural and comforting. Kallen is grateful for the gesture and they both feel better afterwards.","[""I'm really sorry about what happened, Kallen. I know you must be feeling really bad right now.""
 ""Yeah, I am. I just can't believe it happened.""
 ""I know. It's just so unfair.""
 'Yeah. But thanks for coming over and trying to make me feel better. It means a lot.'
 ""Of course, Kallen. I care about you a lot and I just want to see you feeling better. We'll get through this together, okay?""]",['Lauro' 'Kallen' 'Lauro' 'Kallen' 'Lauro'],Lauro,Kallen,,4568831,train,Yes,Yes,Yes,Yes
519,PersonX breaks through PersonY's conviction,xWant,to make PersonY feel better,Maliki breaks through Steffanie's conviction. Now Maliki wants to make Steffanie feel better.,Maliki broke through Steffanie's conviction by making her feel better. He did this by being more understanding and supportive towards her.,"[""Hey, it sounds like you're really upset about what happened.""
 ""Yeah, I just feel so stupid. I can't believe I let myself get talked into something like that.""
 ""It's okay, Steffanie. Everybody makes mistakes sometimes. You're not the first person to get tricked by someone, and you won't be the last.""
 'But it was such a simple thing! I should have known better.'
 ""Sometimes the simplest things can be the most deceptive. But that doesn't mean you're a bad person, or that you deserve to be punished for it.""
 'Thank you for understanding, Maliki. It means a lot to me.'
 ""Of course, Steffanie. I'm here for you, no matter what happens.""]",['Maliki' 'Steffanie' 'Maliki' 'Steffanie' 'Maliki' 'Steffanie' 'Maliki'],Maliki,Steffanie,,4577875,train,Yes,Yes,Yes,Yes
520,PersonX remembers that PersonY is sick,xWant,to make PersonY feel better,Teague remembers that Aveline is sick. Now Teague wants to make Aveline feel better.,Teague remembers that Aveline is sick. Teague gets a glass of water and a blanket for Aveline. Teague also gets some medicine for Aveline to take.,"[""Hey, man. I brought you some water and a blanket. And, uh, here's some medicine for you to take.""
 'Thanks, Teague. I appreciate it.' 'No problem. How are you feeling?'
 ""Not great. I've been throwing up all morning and I have a fever.""
 'That sounds rough. Here, let me help you sit up so you can drink this water.'
 'Thanks. My head is spinning a bit.'
 'Yeah, that\'s the fever talking. Here, drink as much water as you can and then take these pills. They\'ll help with the nausea and the fever."" Aveline takes the pills and drinks the water before lying back down on the bed with a groan.'
 'Do you want me to stay with you for a bit?'
 ""If you don't mind. I appreciate it.""
 ""Of course not. I'll just go sit in that chair over there. Let me know if you need anything else, okay?""]","['Teague' 'Aveline' 'Teague' 'Aveline' 'Teague' 'Aveline' 'Teague'
 'Teague' 'Aveline' 'Teague']",Teague,Aveline,,4594515,train,Yes,Yes,Yes,Yes
521,PersonX asks PersonY to remember the good old days,xIntent,to make PersonY feel better,Shanika asks Latesha to remember the good old days because Shanika wants to make Latesha feel better.,"Latesha and Shanika were walking together down the street, talking about old times. Shanika brought up how things used to be better before Latesha's mom died. Latesha agreed, saying that she sometimes feels like she can't enjoy herself anymore because she has to be the responsible one now.","['You know, I sometimes feel like things were better before your mom died.'
 ""Yeah, I know what you mean. I feel like I can't enjoy myself anymore because I have to be the responsible one now.""
 'Yeah, I remember when your mom used to take us to the park and we would just run around and play all day.'
 'Yeah, those were the days. Sometimes I wish I could just go back to being a kid again.'
 'Me too. But at least we have each other, right?'
 'Right. Thanks for being here for me, Shanika.'
 ""Of course, Latesha. That's what friends are for.""]",['Shanika' 'Latesha' 'Shanika' 'Latesha' 'Shanika' 'Latesha' 'Shanika'],Shanika,Latesha,,4596776,train,Yes,Yes,Yes,Yes
522,PersonX sees that PersonY can sing,xIntent,to make PersonY feel better,Jadore sees that Daniyal can sing because Jadore wants to make Daniyal feel better.,Jadore sees that Daniyal can sing because Jadore heard her voice and it sounded really good. He wants to make Daniyal feel better because she looked really sad when she was singing.,"['Hey, I noticed that you were really sad when you were singing just now. I just wanted to let you know that I think your voice sounds really good.'
 ""Thanks, Jadore. It's just been a really tough week and singing always makes me feel better.""
 ""I'm sorry to hear that. What's been going on?""
 ""It's just been really hard lately. My mom is really sick and she's in the hospital.""
 ""I'm so sorry. Is there anything I can do to help?""
 ""No, I don't think so. Thanks for offering though.""
 ""Of course. If you ever need to talk, I'm here for you.""]",['Jadore' 'Daniyal' 'Jadore' 'Daniyal' 'Jadore' 'Daniyal' 'Jadore'],Jadore,Daniyal,,4634841,train,Yes,Yes,Yes,Yes
523,PersonX touches PersonY on the shoulder,xIntent,to make PersonY feel better,Annastasia touches Haydee on the shoulder because Annastasia wants to make Haydee feel better.,Annastasia touches Haydee's shoulder because Annastasia wants to make sure that Haydee is feeling better. Annastasia also wants to show Haydee that he cares about her and is there for her.,"['Hey, are you feeling better?'
 ""Yeah, I'm feeling better. Thanks for asking.""
 ""Of course. I care about you and want to make sure you're doing well.""
 'I appreciate that. It really means a lot to me.']",['Annastasia' 'Haydee' 'Annastasia' 'Haydee'],Annastasia,Haydee,,4664143,train,Yes,Yes,Yes,No
524,PersonX hears PersonY yell,xWant,to make PersonY feel better,Goldie hears Brystol yell. Now Goldie wants to make Brystol feel better.,Goldie hears Brystol yell. Now Goldie wants to make Brystol feel better by giving her a hug and telling her that everything will be alright.,"['Hey, Brystol. I heard you yelling and I just wanted to give you a hug and tell you that everything will be alright.'
 ""Goldie, I'm so glad you're here! I was just feeling really down and needed someone to talk to.""
 ""Aww, don't worry, Brystol. I'm here for you. Tell me what's going on.""
 ""Well, my boyfriend broke up with me yesterday and it's just been really hard. We were together for two years and I thought things were going great between us. But apparently he had been cheating on me the whole time and didn't even care about me at all. It hurts so much knowing that he never really loved me.""
 ""Oh, Brystol, I'm so sorry to hear that! No one deserves to be treated like that. You are worth so much more than what he did to you.""
 'Thank you, Goldie. Just hearing you say that makes me feel a little better already. Knowing that someone cares about me does make a difference.'
 ""Of course! And like I said, I'm always here for you if you need to talk or vent or anything like that.""]",['Goldie' 'Brystol' 'Goldie' 'Brystol' 'Goldie' 'Brystol' 'Goldie'],Goldie,Brystol,,4669011,train,Yes,Yes,Yes,Yes
525,PersonX makes PersonY's worries go away,xNeed,to make PersonY feel better,Arly made Dennis feel better. Arly makes Dennis' worries go away.,"When Dennis is feeling down, Arly is always there to make him feel better. He always knows just what to say to make Dennis' worries go away. Arly makes Dennis feel loved and appreciated, and that is why Dennis loves spending time with him.","[""Hey, what's wrong? You look really upset.""
 ""I'm just feeling a little down today. I guess I'm just not used to being away from home yet.""
 ""Yeah, I know how you feel. It can be tough adjusting to a new place. But you'll get used to it eventually. And in the meantime, I'm here for you. So if you ever need someone to talk to or just want some company, don't hesitate to come find me.""
 ""Thank you, Arly. Just knowing that you're here for me makes me feel a lot better already.""]",['Arly' 'Dennis' 'Arly' 'Dennis'],Arly,Dennis,,4679266,train,Yes,Yes,Yes,Yes
526,PersonX protects PersonY's feelings,xWant,to make PersonY feel better,Angeles protects Kailea's feelings. Now Angeles wants to make Kailea feel better.,Angeles makes Kailea feel better by being understanding and supportive. He is patient with her and helps her to feel more comfortable with herself. Angeles helps Kailea feel better by making her feel special and appreciated.,"['Hey, Kailea. How are you doing?'
 'Hey, Angeles. Not too bad. Just a little bit anxious, I guess.'
 ""Yeah, I can understand that. It's tough getting used to a new environment. But I think you're doing great so far!""
 'Thanks, Angeles. That means a lot coming from you.'
 ""Of course! I know how much of an adjustment this is for you, and I just want to let you know that I'm here for you if you need anything.""
 ""Thank you, Angeles. Just knowing that you're here for me makes me feel a lot better already.""]",['Angeles' 'Kailea' 'Angeles' 'Kailea' 'Angeles' 'Kailea'],Angeles,Kailea,,4688561,train,Yes,Yes,Yes,Yes
527,PersonX provides a means for acquiring PersonY's sympathy,xIntent,to make PersonY feel better,Jonny provides a means for acquiring Jalia's sympathy because Jonny wants to make Jalia feel better.,"When Jalia came home from his friend's funeral, he was surprised to see Jonny waiting for him. Jonny had been at the funeral, too, and he wanted to make sure Jalia was okay. Jalia appreciated the gesture and they talked for a while about how much they missed their friend.","[""I'm really sorry about your friend. I know you were close.""
 ""Yeah, we were. It's been tough these past few days.""
 ""If there's anything I can do to help, just let me know.""
 ""Thanks, Jonny. Just knowing you're here for me is a big help.""
 ""Of course, Jalia. We're friends, right? That's what friends do for each other.""
 'Yeah. I appreciate it.' 'So, how are you holding up? Really?'
 ""To be honest, I'm not sure. It still feels like a dream, like he's going to walk through the door any minute and this will all have been a terrible nightmare.""
 ""I know how you feel. When my mom died, it was hard for me to believe it at first, too. But eventually, you have to accept that they're really gone and start to move on with your life.""
 ""That's easier said than done.""
 ""I know. But you have to try or else you'll never be able to get over it and be happy again.""]","['Jonny' 'Jalia' 'Jonny' 'Jalia' 'Jonny' 'Jalia' 'Jonny' 'Jalia' 'Jonny'
 'Jalia' 'Jonny']",Jonny,Jalia,,4702547,train,Yes,Yes,No,No
