,head,relation,tail,literal,narrative,dialogue,speakers,PersonX,PersonY,PersonZ,original_index,split,head_answer,pmi_head_answer,relation_tail_answer,pmi_relation_tail_answer
1,PersonX talks to PersonY in the afternoon,xIntent,to make PersonY feel better,Lilibeth talks to Katelyn in the afternoon because Lilibeth wants to make Katelyn feel better.,"Katelyn is sad because her best friend moved away. Lilibeth talks to Katelyn in the afternoon to try and make her feel better. Lilibeth asks Katelyn about her favorite memories with her friend, and Katelyn starts to feel better.","[""Hey, it's Lilibeth. How are you holding up?""
 'Not great. I miss my best friend so much.'
 ""I'm so sorry. What was your favorite memory with her?""
 'We used to spend every Saturday together. We would go to the park and then get ice cream. Just talking and laughing together was the best part.'
 ""That sounds really nice. I'm sure you'll make new memories with other friends, but it's totally natural to miss her right now.""
 ""Yeah, I guess you're right. Thanks for talking to me, Lilibeth.""
 ""Of course! Anytime you need to talk, I'm here for you.""]",['Lilibeth' 'Katelyn' 'Lilibeth' 'Katelyn' 'Lilibeth' 'Katelyn' 'Lilibeth'],Lilibeth,Katelyn,,6032411,train,Yes,Yes,Yes,Yes
6,PersonX mentions some event to PersonY,xIntent,to make PersonY feel better,Seleste mentions some event to Mitzy because Seleste wants to make Mitzy feel better.,"He had seen her looking sad, and he thought that maybe she just needed a pick-me-up.","['Hi, Mitzy. You seem a little down today. Is everything okay?'
 ""Oh, hi Seleste. Yeah, I'm just a bit stressed out lately. It's been tough to keep up with everything.""
 'I completely understand. It sounds like you could really use a pick-me-up then.'
 'A pick-me-up? What do you mean?'
 'Well, something to make you feel better or take your mind off of things for a while. Here, let me show you what I mean. *reaches into pocket and pulls out a small wrapped present* This is for you. I saw it and thought of you right away.'
 ""Awww, Seleste, that's so sweet of you! Thank you so much!""]",['Seleste' 'Mitzy' 'Seleste' 'Mitzy' 'Seleste' 'Mitzy'],Seleste,Mitzy,,6045902,train,Unknown,No,Yes,Yes
7,PersonX relates to PersonY,xIntent,to make PersonY feel better,Gavin relates to Gianella because Gavin wants to make Gianella feel better.,"Gavin hugs Gianella because she wants him to feel better. Gavin thinks that Gianella looks like he needs a hug, and she is happy to provide one.","['Hey, are you okay? You look like you could use a hug.'
 ""Yeah, I'm fine. Just feeling a little down lately.""
 ""Aww, I'm sorry to hear that. Here, give me a hug."" 'Thank you.'
 'No problem. I hope that helped make you feel better.'
 'Yeah, it did. Thanks for being understanding and caring.']",['Gavin' 'Gianella' 'Gavin' 'Gianella' 'Gavin' 'Gianella'],Gavin,Gianella,,6046160,train,Yes,Yes,Yes,Yes
8,PersonX strokes PersonY's hair,xIntent,to make PersonY feel better,Nick strokes Stori's hair because Nick wants to make Stori feel better.,"Nick is stroking Stori's hair because she wants to make him feel better. She knows that he's been through a lot lately, and she just wants to help him in any way she can. She gently runs her fingers through his hair, trying to soothe him the best she can.","[""Hey, it's okay. I'm here for you.""
 'I know. I just feel so lost right now.'
 ""I can imagine. But you're not alone, I promise. We'll get through this together.""
 ""Thank you. Just knowing you're here for me makes me feel a little better already.""
 'Of course, anything for you. So, what do you want to talk about?'
 ""I don't know...everything, I guess?""
 ""Okay, let's start with what's been going on at work then.""
 'Yeah, that sounds like a good place to start...']",['Nick' 'Stori' 'Nick' 'Stori' 'Nick' 'Stori' 'Nick' 'Stori'],Nick,Stori,,6055258,train,Yes,Yes,Yes,Yes
9,PersonX offers a drink to PersonY,xIntent,to make PersonY feel better,Caelan offers a drink to Bethany because Caelan wants to make Bethany feel better.,Caelan offered Bethany a drink of water because Caelan wanted to make her feel better. Bethany had just found out her dog had died and was feeling very sad. Caelan thought a drink of water might help Bethany feel better.,"[""Hi, Bethany. I'm so sorry to hear about your dog. Can I get you a drink of water?""
 'Yes, thank you, Caelan. That would be great.'
 'Here you go. Let me know if you need anything else.' 'Thank you.'
 ""I'm really sorry about your dog, Bethany. Is there anything I can do to help you feel better?""
 'Just being here with me is a big help, Caelan. Thank you.']",['Caelan' 'Bethany' 'Caelan' 'Bethany' 'Caelan' 'Bethany'],Caelan,Bethany,,6061097,train,Yes,Yes,Yes,Yes
10,PersonX sees how upset PersonY is,xIntent,to make PersonY feel better,Golda sees how upset Heavyn is because Golda wants to make Heavyn feel better.,Golda sees how upset Heavyn is because she's crying and her shoulders are shaking. Golda feels bad because she knows that Heavyn is struggling and she wants to help her. Golda comes up with a plan to make Heavyn feel better by giving her a hug and telling her that everything will be alright.,"[""Hey, Heavyn. What's wrong?""
 ""I'm just really struggling right now. I feel like I can't do anything right and everything is falling apart.""
 ""Oh, Heavyn. I'm so sorry. I can tell that you're really upset and I want to help you. Here, give me a hug.""
 ""Thank you, Golda. Just knowing that you're here for me makes me feel a little better already.""
 ""Of course, Heavyn. I'll always be here for you. Now, let's talk about what's going on and see if we can figure out a plan to make things better for you, okay?""
 'Okay.' ""So, what's been going on that's been making you so upset?""
 ""Well, I've just been feeling really down lately. I'm not doing well in school and my parents are constantly fighting. Nothing seems to be going right for me.""
 ""I'm so sorry, Heavyn. That sounds really tough. Do you want to talk about each thing that's going on? We can try to figure out a plan for each problem together.""
 'Yeah, that would be great. Thank you, Golda.'
 ""Okay, let's start with your parents fighting. What usually happens when they fight?""
 ""They just start yelling at each other and it gets really intense. Sometimes they even throw things or slam doors. It's really scary and it makes me feel like they're going to get divorced or something bad is going to happen.""
 'That does sound pretty scary and intense. Have you talked to them about how their fighting is affecting you?'
 ""No, I haven't because I'm afraid of what they might say or do if I bring it up. Plus, they always seem so wrapped up in their own problems that they don't even notice how much their fighting affects me.""
 'Well, maybe we can brainstorm a way for you to bring it up with them without them getting too upset? What do you think?'
 ""Yeah, that could work. But even if I do talk to them about it, I don't know if anything will change because they've been arguing a lot lately no matter what I do or say""]","['Golda' 'Heavyn' 'Golda' 'Heavyn' 'Golda' 'Heavyn' 'Golda' 'Heavyn'
 'Golda' 'Heavyn' 'Golda' 'Heavyn' 'Golda' 'Heavyn' 'Golda' 'Heavyn']",Golda,Heavyn,,6061100,train,Yes,Yes,Yes,Yes
11,PersonX feels PersonY,xWant,to make PersonY feel better,Garth feels Jamar. Now Garth wants to make Jamar feel better.,"Garth felt compassion for Jamar when she saw how down she looked. Garth decided she wanted to make Jamar feel better, so she went over and asked if she was okay. When Jamar said she was feeling a little down, Garth offered to get her a drink or something to eat.","['Hi, are you okay? You look a little down.'
 ""Yeah, I'm just feeling a little down today.""
 ""Oh, I'm sorry to hear that. Is there anything I can do to help make you feel better?""
 'Well, maybe getting me a drink or something to eat would help.'
 ""Okay, sure. I'll be right back."" 'Here you go. I hope this helps.'
 'Thank you. It does help. I appreciate it.']",['Garth' 'Jamar' 'Garth' 'Jamar' 'Garth' 'Garth' 'Jamar'],Garth,Jamar,,6083202,train,Yes,Yes,Yes,Yes
12,PersonX feeds PersonY's need for reassurance,xWant,to make PersonY feel better,Mckinlee feeds Sohan's need for reassurance. Now Mckinlee wants to make Sohan feel better.,"Mckinlee feeds Sohan's need for reassurance by making him feel better. Mckinlee does this by talking to Sohan, reassuring him that everything is going to be alright, and by giving him a hug.","[""Hey, it's okay. I'm here for you."" 'I just feel so lost right now.'
 ""You're not lost. I'm here with you. We'll get through this together.""
 ""But what if we can't?"" ""We will, because we're in this together.""
 'Thank you, Mckinlee.' 'Any time.']",['Mckinlee' 'Sohan' 'Mckinlee' 'Sohan' 'Mckinlee' 'Sohan' 'Mckinlee'],Mckinlee,Sohan,,6092213,train,Yes,Yes,Yes,Yes
13,PersonX talks to PersonY alone,xIntent,to make PersonY feel better,Clair talks to Taliyah alone because Clair wants to make Taliyah feel better.,Clair talks to Taliyah alone because Clair wants to make Taliyah feel better. Clair knows that Taliyah is feeling down because he didn't make the basketball team. Clair tells Taliyah that it's okay and that he will still be her friend no matter what.,"[""Hey, Taliyah. I saw that you didn't make the basketball team. I'm sorry.""
 ""It's fine. I'm not good enough anyway.""
 ""That's not true! You're a great player! I'm sure you just didn't make it because there were too many other people trying out.""
 'Maybe. But it still sucks.'
 ""Yeah, I know how you feel. When I was in seventh grade, I really wanted to be on the cheerleading squad but I didn't make it either. It felt terrible at first but eventually, I got over it and realized that there are other things that are more important than being on a team. And even though we're not on the same team, we're still friends, right?""
 'Yeah, of course we are!']",['Clair' 'Taliyah' 'Clair' 'Taliyah' 'Clair' 'Taliyah'],Clair,Taliyah,,6092843,train,Yes,Yes,Yes,Yes
14,PersonX works on getting to know PersonY,xIntent,to make PersonY feel better,Garner works on getting to know Leela because Garner wants to make Leela feel better.,"Garner is trying to get to know Leela better so that Leela will feel more comfortable. Garner asks Leela about his hobbies, favorite things, and anything else that might help Garner get to know Leela better.","['So Leela, what do you like to do for fun?'
 'I like playing video games and basketball.'
 ""That's great! What kind of video games do you like to play?""
 'I really like first-person shooter games and driving games.'
 ""Okay, so you're into the action and fast-paced games. Do you have a favorite driving game?""
 ""Yeah, I really like Need for Speed. It's really cool to be able to race through different tracks and try to beat your best time.""
 'That sounds like a lot of fun! Do you play online with other people or just by yourself?'
 ""Sometimes I'll play with my friends online, but mostly I just play by myself. I find it more challenging that way.""
 ""I can understand that. Sometimes it's more fun to see how far you can push yourself.""
 'Yeah, exactly.' 'So, is basketball your favorite sport?'
 'Yeah, I really enjoy playing it. I like the feeling of scoring points and working as a team to try and win the game.'
 'That sounds like a lot of fun! Do you play on a team or just in pick-up games?'
 'I used to play on a team when I was younger, but now I just stick to pick-up games with my friends.'
 ""That's still great! It's important to stay active and have fun. Do you have any other hobbies?""
 ""Not really. I mean, I like hanging out with my friends and watching movies, but nothing else that I'm really into.""]","['Garner' 'Leela' 'Garner' 'Leela' 'Garner' 'Leela' 'Garner' 'Leela'
 'Garner' 'Leela' 'Garner' 'Leela' 'Garner' 'Leela' 'Garner' 'Leela']",Garner,Leela,,6094172,train,Yes,Yes,Yes,No
15,PersonX brings PersonY back to his place,xIntent,to make PersonY feel better,Sagar brings Shruti back to his place because Sagar wants to make Shruti feel better.,"Shruti was having a tough day, so Sagar offered to take her back to his place to cheer her up. He fixed her a drink and they talked and laughed for hours. By the end of the night, Shruti was feeling much better.","['Hey, Shruti. I noticed you were having a tough day today. Are you doing alright?'
 ""Yeah, I'm doing alright. Thanks for asking. It's just been one of those days, you know?""
 ""I completely understand. Here, let me fix you a drink. It'll make you feel better.""
 ""Thank you, Sagar. That's really sweet of you.""
 ""It's no problem at all. I just want to make sure you're okay.""
 'I appreciate it.' ""So, what's been going on? What's been bothering you?""
 ""It's just work, you know. It's been really stressful lately and I can't seem to get ahead.""
 ""That sounds rough. I'm sure it'll all work out in the end, though. You're a tough cookie, Shruti.""
 'Thanks, Sagar. Just hearing you say that makes me feel a little better already.'
 ""Good! That's what I wanted to hear. Now drink up and relax a little bit, okay?""
 'Alright, thanks again.']","['Sagar' 'Shruti' 'Sagar' 'Shruti' 'Sagar' 'Shruti' 'Sagar' 'Shruti'
 'Sagar' 'Shruti' 'Sagar' 'Shruti']",Sagar,Shruti,,6094946,train,Yes,Yes,Yes,Yes
16,PersonX and PersonY speak very frankly,xIntent,to make PersonY feel better,Rodriquez and Naimah speak very frankly because Rodriquez wants to make Naimah feel better.,Rodriquez and Naimah spoke very frankly because Rodriquez wanted to make Naimah feel better. She told her that she had been through a lot lately and that she understood how she felt. She also told her that she was there for her if she needed to talk.,"['Hey, Naimah. I wanted to talk to you about something.' ""What's up?""
 ""I know you've been going through a lot lately and I just wanted to let you know that I understand how you feel. I've been through a lot myself and I know it's not easy. But I want you to know that I'm here for you if you need to talk. Just let me know if there's anything I can do, okay?""
 ""Thanks, Val. I appreciate that. I'm just feeling a bit overwhelmed right now.""
 ""Yeah, I can imagine. It's a lot to deal with. But like I said, I'm here for you if you need anything. Just let me know.""]",['Rodriquez' 'Naimah' 'Rodriquez' 'Naimah' 'Rodriquez'],Rodriquez,Naimah,,6099877,train,Yes,Yes,Yes,Yes
17,PersonX gets to know PersonY better,xIntent,to make PersonY feel better,Lou gets to know Weldon better because Lou wants to make Weldon feel better.,"Lou and Weldon had been talking for a while before Lou finally asked her out. He did it because he wanted to get to know her better, and he could tell that she was lonely. Plus, he thought she was really cute.","[""I've really enjoyed talking to you, Weldon. I was wondering if you might want to go out sometime?""
 ""I'd love to! I'm so sick of being cooped up in this house all the time. When were you thinking?""
 'How about Friday night?' 'That sounds great! What should we do?'
 ""Well, there's a new movie out that I've been wanting to see. We could go see that and then grab dinner afterwards.""
 ""That sounds like a perfect date! I'll see you on Friday then.""]",['Lou' 'Weldon' 'Lou' 'Weldon' 'Lou' 'Weldon'],Lou,Weldon,,6108504,train,Yes,Yes,Yes,No
18,PersonX reveals secret to PersonY,xIntent,to make PersonY feel better,Mckenzie reveals secret to Jalan because Mckenzie wants to make Jalan feel better.,Mckenzie told Jalan that he really liked her and that he thought she was pretty. He also told her that he thought she was a good person.,"[""I really like you, Jalan. I think you're pretty and I think you're a good person.""
 'Thanks, Mckenzie. I appreciate that. I like you too.'
 ""I'm glad we like each other. I think we could be really good friends.""
 'I agree, Mckenzie. I think we could be great friends.']",['Mckenzie' 'Jalan' 'Mckenzie' 'Jalan'],Mckenzie,Jalan,,6116858,train,Yes,Yes,No,No
20,PersonX takes PersonY by the arm,xWant,to make PersonY feel better,Konrad takes Nya by the arm. Now Konrad wants to make Nya feel better.,"Konrad took Nya by the arm. Konrad wanted to make Nya feel better, so she took her out for coffee.","['Hey, are you okay? You looked really upset back there.'
 ""Yeah, I'm fine. I just can't believe that happened. It was so humiliating.""
 ""I know. It's tough when something like that happens unexpectedly. But you handled it well, considering the circumstances.""
 ""Thanks. I guess I just feel like such a fool right now. Everyone must think I'm an idiot.""
 ""Don't worry about what other people think. They don't know what it's like to be in your shoes and they're not worth your time or energy anyway. Just focus on how you're feeling and what you need to do to take care of yourself right now.""
 ""Yeah, I guess you're right. Thanks for understanding, Konrad.""
 ""Of course. If you ever need to talk, don't hesitate to reach out to me. I'm always here for you.""]",['Konrad' 'Nya' 'Konrad' 'Nya' 'Konrad' 'Nya' 'Konrad'],Konrad,Nya,,6135956,train,Yes,Yes,Yes,Yes
21,PersonX rubs PersonY's head,xIntent,to make PersonY feel better,Adysen rubs Dyllon's head because Adysen wants to make Dyllon feel better.,"Adysen was rubbing Dyllon's head because she had a headache. Adysen wanted to make her feel better, so he rubbed her head and back for a few minutes.","['Dyllon, are you feeling any better?'
 'Yes, thank you. The pain is subsiding a bit.'
 ""Good. I'm glad I could help.""
 ""Me too. It's really sweet of you to care so much.""
 ""Of course! You're my friend and I want you to feel better.""
 'Thank you, Adysen. I appreciate it.']",['Adysen' 'Dyllon' 'Adysen' 'Dyllon' 'Adysen' 'Dyllon'],Adysen,Dyllon,,6142179,train,Yes,Yes,Yes,Yes
23,PersonX is surprised at PersonY's fear,xWant,to make PersonY feel better,Eloise is surprised at Kevion's fear. Now Eloise wants to make Kevion feel better.,"Eloise was surprised at Kevion's fear. He had never seen Kevion so scared before. Eloise wanted to make Kevion feel better, so he put his arm around him and told him it would be okay.","[""It'll be okay, Kevion. I promise. Whatever you're worried about, we'll face it together.""
 ""I don't know if I can do this, Eloise. I'm so scared.""
 ""You're not alone, Kevion. I'm here with you. We'll get through this together.""
 ""Thank you, Eloise. Just knowing you're here with me makes me feel a little better.""
 ""That's what friends are for, right? To help each other through tough times?""
 'Yes, thank you for being my friend, Eloise.']",['Eloise' 'Kevion' 'Eloise' 'Kevion' 'Eloise' 'Kevion'],Eloise,Kevion,,6162088,train,Yes,Yes,Yes,Yes
24,PersonX assures PersonY of it,xWant,to make PersonY feel better,Trinton assures Clarice of it. Now Trinton wants to make Clarice feel better.,Trinton comforts Clarice by gently placing his hand on her arm and assuring her that everything will be alright. He then proceeds to tell her a joke to lighten the mood.,"[""Clarice, I'm so sorry about what happened. I know it's hard to lose someone you care about. But I promise you, everything will be alright.""
 ""I don't know, Trinton. I just feel so lost right now.""
 'I understand how you feel. But like I said, things will get better. Here, let me tell you a joke to cheer you up. Why did the chicken cross the road?'
 'To get to the other side!']",['Trinton' 'Clarice' 'Trinton' 'Clarice'],Trinton,Clarice,,6163485,train,Yes,Yes,Yes,Yes
26,PersonX sends PersonY to town,xIntent,to make PersonY feel better,Cooper sends Ryver to town because Cooper wants to make Ryver feel better.,"Ryver was feeling down, so Cooper suggested he go into town to get some fresh air. She knew the change of scenery would do him some good.","[""Ryver, you've been moping around the house all day. I think you could use some fresh air.""
 ""Yeah, I guess you're right.""
 ""Why don't you go into town and get some coffee or something?""
 'Yeah, that sounds like a good idea. Thanks, Cooper.'
 ""You're welcome. Have a great time!"" ""Hey, Cooper. I'm back.""
 'Hey! How was your time in town?'
 'It was great, actually. I got some coffee and ended up walking around for a bit. The change of scenery was really what I needed.'
 ""I'm glad you had a good time!""]","['Cooper' 'Ryver' 'Cooper' 'Ryver' 'Cooper' 'Ryver' 'Cooper' 'Ryver'
 'Cooper']",Cooper,Ryver,,6212225,train,Yes,Yes,Yes,Yes
28,PersonX hands PersonY the blanket,xIntent,to make PersonY feel better,Alysha hands Jalyn the blanket because Alysha wants to make Jalyn feel better.,"Jalyn feels cold, so Alysha hands him a blanket.","['Hey, you look cold. Here, take my blanket.' ""Thanks. I'm really cold.""
 ""It's no problem. I can't stand to see you suffer.""
 'I appreciate it. This blanket is really warm.'
 ""I'm glad it's helping. Let me know if you need anything else, okay?""
 'Will do. Thanks again.']",['Alysha' 'Jalyn' 'Alysha' 'Jalyn' 'Alysha' 'Jalyn'],Alysha,Jalyn,,6245387,train,Yes,Yes,Yes,Yes
29,PersonX makes PersonY feel at ease,xWant,to make PersonY feel better,Jayson makes Tariah feel at ease. Now Jayson wants to make Tariah feel better.,"After getting to know each other a little better, Jayson makes Tariah feel at ease by sharing some of her own personal experiences. Now Jayson wants to make Tariah feel better by cooking her favorite meal and bringing it to her with a bouquet of flowers.","['Hey Tariah. How are you doing?'
 ""I'm okay, I guess. Just feeling a little down lately.""
 ""Yeah, I can understand that. I've been through some tough times myself. But I've found that cooking my favorite meal and then eating it with someone I care about always makes me feel better. Would you like me to make you something special and bring it over to your place?""
 ""Wow, that's really sweet of you, Jayson. Yes, I would love that. Thank you so much!""
 ""You're welcome, Tariah. I'll see you soon."" 'Thank you again, Jayson.']",['Jayson' 'Tariah' 'Jayson' 'Tariah' 'Jayson' 'Tariah'],Jayson,Tariah,,6248896,train,Yes,Yes,Yes,Yes
30,PersonX feeds PersonY meat,xIntent,to make PersonY feel better,Maddilyn feeds Cambri meat because Maddilyn wants to make Cambri feel better.,"Maddilyn felt bad that Cambri was feeling sick, so he decided to make him a special meal of his favorite foods. He cooked up a big juicy steak and some roasted potatoes, and brought it all into Cambri's room on a tray. Cambri was so happy to have his favorite meal, and he felt much better afterwards.","[""I'm so sorry to hear that you're not feeling well, Cambri. I wanted to make you your favorite meal to try and make you feel better.""
 'Thank you so much, Maddilyn. I really appreciate it. This is exactly what I needed.'
 ""I'm just glad I could help. Let me know if there's anything else I can do for you.""
 'Actually, there is one thing...' 'Sure, anything. Just name it.'
 ""Well, I've been feeling a little cooped up in this room lately and I was wondering if maybe you could take me for a walk outside?""
 ""Of course! That sounds like a great idea. Let me help you get dressed and we'll head out right away.""]",['Maddilyn' 'Cambri' 'Maddilyn' 'Cambri' 'Maddilyn' 'Cambri' 'Maddilyn'],Maddilyn,Cambri,,6251864,train,Yes,Yes,Unknown,No
32,PersonX deals with PersonY's fear,xWant,to make PersonY feel better,Arnold deals with Ebonee's fear. Now Arnold wants to make Ebonee feel better.,Arnold talked to Ebonee about his fear and explained that there was nothing to be afraid of. He reassured Ebonee that he would always be there for him and that he would never let anything happen to him. This made Ebonee feel better and he was no longer afraid.,"[""Hey Ebonee, what's up? You seem a little down.""
 ""Yeah, I've just been feeling a bit off lately. I don't know what it is.""
 ""Well, whatever it is, I'm here for you. You can talk to me about anything, you know that.""
 ""Thanks, Arnold. Just knowing you're here for me makes me feel a bit better already.""
 ""Of course! Now, what's going on? What's got you so upset?""
 ""It's just...I don't know. I feel like there's something bad going to happen, like something really terrible is going to happen and there's nothing I can do to stop it. It's just this feeling that won't go away no matter what I do.""
 ""Hey, it's okay. There's nothing wrong with being afraid of something like that happening. But you have to remember that bad things happen to everyone at some point in their life - it doesn't mean that they're necessarily going to happen to you specifically. And even if they do happen, we'll face them together - I'll be right there with you the whole way. Okay?""
 'Okay...yeah, that does make me feel better actually hearing you say that. Thank you so much, Arnold!']",['Arnold' 'Ebonee' 'Arnold' 'Ebonee' 'Arnold' 'Ebonee' 'Arnold' 'Ebonee'],Arnold,Ebonee,,6292586,train,Yes,Yes,Yes,Yes
33,PersonX argues that PersonY has feelings,xWant,to make PersonY feel better,Aissatou argues that Markese has feelings. Now Aissatou wants to make Markese feel better.,"Markese was feeling down, so Aissatou decided to cheer him up. She told him some jokes, and he laughed. Then she gave him a hug, and he felt better.","[""Hey Markese, what's up?"" 'Not much. Just feeling a little down.'
 ""Well, I'm here to cheer you up! I've got some jokes for you.""
 'Alright, hit me with them.'
 'Okay, so why did the chicken cross the road?'
 'To get to the other side?'
 'Exactly! And why did the duck cross the road?' ""Um...I don't know. Why?""
 'To get to the other side! And why did the mosquito cross the road?'
 'I have no idea. Why?' 'To get to the other side!'
 'Ha, okay that made me laugh. Thanks.'
 ""No problem! Now give me a hug, and you'll feel even better.""
 'Alright, thanks Aissatou.']","['Aissatou' 'Markese' 'Aissatou' 'Markese' 'Aissatou' 'Markese' 'Aissatou'
 'Markese' 'Aissatou' 'Markese' 'Aissatou' 'Markese' 'Aissatou' 'Markese']",Aissatou,Markese,,6296685,train,Yes,Yes,Yes,No
